Sheet: Beam design
D1: UNITS | J1: 1 | K1: 2 | L1: 3 | M1: 4 | N1: 5 | O1: 6 | P1: 7 | Q1: 8 | R1: 9 | S1: 10 | T1: 11 | U1: 12 | V1: 13 | W1: 14 | X1: 15 | Y1: 16 | Z1: 17 | AA1: 18 | AB1: 19
B2: Length | C2: 5000 | D2: mm | J2: Section Name | K2: Weight per Meter Kg | L2: Sectional Area mm2 | M2: Depth mm | N2: Width of flange mm | O2: Thickness of flange mm | P2: Thickness of web mm | Q2: Ixx | R2: Iyy | S2: rxx | T2: ryy | U2: Radius of root r1 | V2: Radius of toe r2 | W2: h1 | X2: h2 | Y2: Zxx | Z2: Zyy | AA2: Section Name
B3: LL | C3: 20 | D3: KN/m | F3: E | G3: 200000
B4: DL | C4: 0.6 | D4: KN/m | I4: 1 | J4: ISJB150 | K4: 7.1 | L4: 901 | M4: 150 | N4: 50 | O4: 4.6 | P4: 3 | Q4: 3221000.061 | R4: 91999.9981 | S4: 59.7906 | T4: 10.1049 | U4: 5.98 | V4: 1.01 | W4: 130.4 | X4: 9.8 | Y4: 42946.6675 | Z4: 3679.9999 | AA4: ISJB150
B5: TL | C5: of:=[.C3]+[.C4] -> 20.6 | D5: KN/m | I5: 2 | J5: ISJB175 | K5: 8.1 | L5: 1028 | M5: 175 | N5: 50 | O5: 4.8 | P5: 3.2 | Q5: 4792999.878 | R5: 96999.9981 | S5: 68.2821 | T5: 9.7138 | U5: 6.83 | V5: 0.97 | W5: 155 | X5: 10 | Y5: 54777.1415 | Z5: 3879.9999 | AA5: ISJB175
B6: fy | C6: 250 | D6: N/mm | I6: 3 | J6: ISJB200 | K6: 9.9 | L6: 1264 | M6: 200 | N6: 60 | O6: 5 | P6: 3.4 | Q6: 7807000.122 | R6: 172999.9924 | S6: 78.5902 | T6: 11.699 | U6: 7.86 | V6: 1.17 | W6: 179.5 | X6: 10.25 | Y6: 78070.0012 | Z6: 5766.6664 | AA6: ISJB200
B7: SIGMAbc | C7: of:=0.66*[.C6] -> 165 | D7: N/mm | I7: 4 | J7: ISJB225 | K7: 12.8 | L7: 1628.0001 | M7: 225 | N7: 80 | O7: 5 | P7: 3.7 | Q7: 13085000 | R7: 405000 | S7: 89.6519 | T7: 15.7725 | U7: 8.97 | V7: 1.58 | W7: 201.1 | X7: 11.95 | Y7: 116311.1111 | Z7: 10125 | AA7: ISJB225
B8: Mmax | C8: of:=(([.C5]*[.C2]*[.C2])/8) -> 64375000 | D8: Nmm
B9: Vmax | C9: of:=(([.C5]*[.C2])/2) -> 51500 | D9: N | AC9: 33600
B10: Zreq | C10: of:=([.C8]/[.C7]) -> 390151.515151515 | D10: mm3 | J10: ISLB75 | K10: 6.1 | L10: 771 | M10: 75 | N10: 50 | O10: 5 | P10: 3.7 | Q10: 726999.9695 | R10: 100000 | S10: 30.7072 | T10: 11.3887 | U10: 3.07 | V10: 1.14 | W10: 51.7 | X10: 11.65 | Y10: 19386.6659 | Z10: 4000 | AA10: ISLB75 | AB10: 33600 | AC10: 65087.998
J11: ISLB100 | K11: 8 | L11: 1021 | M11: 100 | N11: 50 | O11: 6.4 | P11: 4 | Q11: 1680000 | R11: 126999.9981 | S11: 40.5641 | T11: 11.1529 | U11: 4.06 | V11: 1.12 | W11: 73 | X11: 13.5 | Y11: 33600 | Z11: 5079.9999 | AA11: ISLB100 | AB11: 65087.998 | AC11: 91760.0016
J12: ISLB125 | K12: 11.9 | L12: 1512 | M12: 125 | N12: 75 | O12: 6.5 | P12: 4.4 | Q12: 4067999.878 | R12: 434000.0153 | S12: 51.8698 | T12: 16.9422 | U12: 5.19 | V12: 1.69 | W12: 95.4 | X12: 14.8 | Y12: 65087.998 | Z12: 11573.3337 | AA12: ISLB125 | AB12: 91760.0016 | AC12: 125279.9944
J13: ISLB150 | K13: 14.2 | L13: 1808 | M13: 150 | N13: 80 | O13: 6.8 | P13: 4.8 | Q13: 6882000.122 | R13: 552000.0076 | S13: 61.6962 | T13: 17.4731 | U13: 6.17 | V13: 1.75 | W13: 116.9 | X13: 16.55 | Y13: 91760.0016 | Z13: 13800.0002 | AA13: ISLB150 | AB13: 125279.9944 | AC13: 169659.9976
A14: ISLB | J14: ISLB175 | K14: 16.7 | L14: 2129.9999 | M14: 175 | N14: 90 | O14: 6.9 | P14: 5.1 | Q14: 10961999.512 | R14: 795999.9847 | S14: 71.739 | T14: 19.3316 | U14: 7.17 | V14: 1.93 | W14: 141.6 | X14: 16.7 | Y14: 125279.9944 | Z14: 17688.8885 | AA14: ISLB175 | AB14: 169659.9976 | AC14: 222391.1024
J15: ISLB200 | K15: 19.8 | L15: 2527 | M15: 200 | N15: 100 | O15: 7.3 | P15: 5.4 | Q15: 16965999.756 | R15: 1154000.0153 | S15: 81.9383 | T15: 21.3698 | U15: 8.19 | V15: 2.13 | W15: 165.7 | X15: 17.15 | Y15: 169659.9976 | Z15: 23080.0003 | AA15: ISLB200 | AB15: 222391.1024 | AC15: 297424.0039
A16: LOWER | B16: of:=VLOOKUP([.C10];[.Y10:.AA26];1) -> 297424.0039 | J16: ISLB225 | K16: 23.5 | L16: 2992 | M16: 225 | N16: 100 | O16: 8.6 | P16: 5.8 | Q16: 25018999.023 | R16: 1126999.9695 | S16: 91.4438 | T16: 19.408 | U16: 9.15 | V16: 1.94 | W16: 180.3 | X16: 22.35 | Y16: 222391.1024 | Z16: 22539.9994 | AA16: ISLB225 | AB16: 297424.0039 | AC16: 390930.8949
J17: ISLB250 | K17: 27.9 | L17: 3552.9999 | M17: 250 | N17: 125 | O17: 8.2 | P17: 6.1 | Q17: 37178000.49 | R17: 1933999.939 | S17: 102.2929 | T17: 23.3309 | U17: 10.23 | V17: 2.33 | W17: 202.6 | X17: 23.7 | Y17: 297424.0039 | Z17: 30943.999 | AA17: ISLB250 | AB17: 390930.8949 | AC17: 488859.9935
A18: UPPER 1 | B18: of:=VLOOKUP([.C10];[.Y10:.AB26];4) -> 390930.8949 | D18: UPPER 2 | E18: of:=VLOOKUP([.C10];[.Y10:.AC26];5) -> 488859.9935 | J18: ISLB275 | K18: 33 | L18: 4202 | M18: 275 | N18: 140 | O18: 8.8 | P18: 6.4 | Q18: 53752998.05 | R18: 2870000 | S18: 113.1028 | T18: 26.1344 | U18: 11.31 | V18: 2.61 | W18: 223.7 | X18: 25.65 | Y18: 390930.8949 | Z18: 41000 | AA18: ISLB275 | AB18: 488859.9935 | AC18: 607667.6683
J19: ISLB300 | K19: 37.7 | L19: 4808.0002 | M19: 300 | N19: 150 | O19: 9.4 | P19: 6.7 | Q19: 73328999.02 | R19: 3762000.122 | S19: 123.4968 | T19: 27.9722 | U19: 12.35 | V19: 2.8 | W19: 245.1 | X19: 27.45 | Y19: 488859.9935 | Z19: 50160.0016 | AA19: ISLB300 | AB19: 607667.6683 | AC19: 751902.846
A20: SECTION SATISFIED | B20: of:=VLOOKUP([.B18];[.Y10:.AA26];3) -> ISLB275 | E20: of:=VLOOKUP([.E18];[.Y10:.AA26];3) -> ISLB300 | J20: ISLB325 | K20: 43.1 | L20: 5490.0002 | M20: 325 | N20: 165 | O20: 9.8 | P20: 7 | Q20: 98745996.09 | R20: 5107999.878 | S20: 134.1138 | T20: 30.5028 | U20: 13.41 | V20: 3.05 | W20: 266.5 | X20: 29.25 | Y20: 607667.6683 | Z20: 61915.15 | AA20: ISLB325 | AB20: 751902.846 | AC20: 965315.0391
J21: ISLB350 | K21: 49.5 | L21: 6300.9998 | M21: 350 | N21: 165 | O21: 11.4 | P21: 7.4 | Q21: 131582998.05 | R21: 6319000.244 | S21: 144.5091 | T21: 31.6679 | U21: 14.45 | V21: 3.17 | W21: 288.3 | X21: 30.85 | Y21: 751902.846 | Z21: 76593.9424 | AA21: ISLB350 | AB21: 965315.0391 | AC21: 1223826.6493
A22: D | B22: of:=VLOOKUP([.B20];[.J10:.AA26];4) -> 275 | E22: of:=VLOOKUP([.E20];[.J10:.AA26];4) -> 300 | J22: ISLB400 | K22: 56.9 | L22: 7243 | M22: 400 | N22: 165 | O22: 12.5 | P22: 8 | Q22: 193063007.81 | R22: 7164000.244 | S22: 163.2639 | T22: 31.4498 | U22: 16.33 | V22: 3.15 | W22: 336.2 | X22: 31.9 | Y22: 965315.0391 | Z22: 86836.3666 | AA22: ISLB400 | AB22: 1223826.6493 | AC22: 1543160
A23: tf | B23: of:=VLOOKUP([.B20];[.J10:.AA26];6) -> 8.8 | E23: of:=VLOOKUP([.E20];[.J10:.AA26];6) -> 9.4 | J23: ISLB450 | K23: 65.3 | L23: 8313.9999 | M23: 450 | N23: 170 | O23: 13.4 | P23: 8.6 | Q23: 275360996.09 | R23: 8530000 | S23: 181.9894 | T23: 32.0309 | U23: 18.2 | V23: 3.2 | W23: 384 | X23: 33 | Y23: 1223826.6493 | Z23: 100352.9412 | AA23: ISLB450 | AB23: 1543160 | AC23: 1933149.1477
A24: tw | B24: of:=VLOOKUP([.B20];[.J10:.AA26];7) -> 6.4 | E24: of:=VLOOKUP([.E20];[.J10:.AA26];7) -> 6.7 | J24: ISLB500 | K24: 75 | L24: 9550 | M24: 500 | N24: 180 | O24: 14.1 | P24: 9.2 | Q24: 385790000 | R24: 10639000.244 | S24: 200.9897 | T24: 33.3771 | U24: 20.1 | V24: 3.34 | W24: 430.2 | X24: 34.9 | Y24: 1543160 | Z24: 118211.1138 | AA24: ISLB500 | AB24: 1933149.1477 | AC24: 2428920.0521
A25: h2 | B25: of:=VLOOKUP([.B20];[.J10:.AA26];15) -> 25.65 | E25: of:=VLOOKUP([.E20];[.J10:.AA26];15) -> 27.45 | J25: ISLB550 | K25: 96.3 | L25: 10997.0001 | M25: 550 | N25: 190 | O25: 15 | P25: 9.9 | Q25: 531616015.6 | R25: 13350999.756 | S25: 219.8679 | T25: 34.8433 | U25: 21.99 | V25: 3.48 | W25: 476.1 | X25: 36.95 | Y25: 1933149.1477 | Z25: 140536.8395 | AA25: ISLB550 | AB25: 2428920.0521
A26: zxx | B26: of:=VLOOKUP([.B20];[.J10:.AA26];16) -> 390930.8949 | E26: of:=VLOOKUP([.E20];[.J10:.AA26];16) -> 488859.9935 | J26: ISLB600 | K26: 99.5 | L26: 12669.0002 | M26: 600 | N26: 210 | O26: 15.5 | P26: 10.5 | Q26: 728676015.6 | R26: 18219000.244 | S26: 239.8259 | T26: 37.922 | U26: 23.98 | V26: 3.79 | W26: 520.2 | X26: 39.9 | Y26: 2428920.0521 | Z26: 173514.288 | AA26: ISLB600
A27: ixx | B27: of:=VLOOKUP([.B20];[.J10:.AA26];8) -> 53752998.05 | E27: of:=VLOOKUP([.E20];[.J10:.AA26];8) -> 73328999.02
A28: iyy | B28: of:=VLOOKUP([.B20];[.J10:.AA26];9) -> 2870000 | E28: of:=VLOOKUP([.E20];[.J10:.AA26];9) -> 3762000.122
A29: ryy | B29: of:=VLOOKUP([.B20];[.J10:.AA26];11) -> 26.1344 | E29: of:=VLOOKUP([.E20];[.J10:.AA26];10) -> 123.4968
I30: 22 | J30: ISMB100 | K30: 11.5 | L30: 1460 | M30: 100 | N30: 75 | O30: 7.2 | P30: 4 | Q30: 2575000 | R30: 407999.9924 | S30: 41.9964 | T30: 16.7168 | U30: 4.2 | V30: 1.67 | W30: 65 | X30: 17.5 | Y30: 51500 | Z30: 10879.9998 | AA30: ISMB100
A31: Check fo shear | I31: 23 | J31: ISMB125 | K31: 13 | L31: 1660 | M31: 125 | N31: 75 | O31: 7.6 | P31: 4.4 | Q31: 4490000 | R31: 437000.0076 | S31: 52.0079 | T31: 16.2251 | U31: 5.2 | V31: 1.62 | W31: 89.2 | X31: 17.9 | Y31: 71840 | Z31: 11653.3335 | AA31: ISMB125
I32: 24 | J32: ISMB150 | K32: 14.9 | L32: 1900 | M32: 150 | N32: 80 | O32: 7.6 | P32: 4.8 | Q32: 7264000.244 | R32: 525999.9847 | S32: 61.8317 | T32: 16.6386 | U32: 6.18 | V32: 1.66 | W32: 113.9 | X32: 18.05 | Y32: 96853.3366 | Z32: 13149.9996 | AA32: ISMB150
A33: tau(va) | B33: of:=[.C9]/([.B22]*[.B24]) -> 29.2613636363636 | C33: <100 safe | E33: of:=[.C9]/([.E22]*[.E24]) -> 25.6218905472637 | F33: <100 safe | I33: 25 | J33: ISMB175 | K33: 19.3 | L33: 2462.0001 | M33: 175 | N33: 90 | O33: 8.6 | P33: 5.5 | Q33: 12720000 | R33: 850000 | S33: 71.8786 | T33: 18.5808 | U33: 7.19 | V33: 1.86 | W33: 134.5 | X33: 20.25 | Y33: 145371.4286 | Z33: 18888.8889 | AA33: ISMB175
I34: 26 | J34: ISMB200 | K34: 25.4 | L34: 3233.0002 | M34: 200 | N34: 100 | O34: 10.8 | P34: 5.7 | Q34: 22353999.023 | R34: 1500000 | S34: 83.1524 | T34: 21.5399 | U34: 8.32 | V34: 2.15 | W34: 152.7 | X34: 23.65 | Y34: 223539.9902 | Z34: 30000 | AA34: ISMB200
A35: check for deflection | I35: 27 | J35: ISMB225 | K35: 31.2 | L35: 3972.0001 | M35: 225 | N35: 110 | O35: 11.8 | P35: 6.5 | Q35: 34418000.49 | R35: 2183000.0305 | S35: 93.0868 | T35: 23.4435 | U35: 9.31 | V35: 2.34 | W35: 173.3 | X35: 25.85 | Y35: 305937.7821 | Z35: 39690.9096 | AA35: ISMB225
I36: 28 | J36: ISMB250 | K36: 37.3 | L36: 4754.9999 | M36: 250 | N36: 125 | O36: 12.5 | P36: 6.9 | Q36: 51316000.98 | R36: 3345000 | S36: 103.8846 | T36: 26.523 | U36: 10.39 | V36: 2.65 | W36: 194.1 | X36: 27.95 | Y36: 410528.0078 | Z36: 53520 | AA36: ISMB250
A37: Delta allowable | B37: of:=([.C2])/325 -> 15.3846153846154 | I37: 29 | J37: ISMB300 | K37: 44.2 | L37: 5625.9998 | M37: 300 | N37: 140 | O37: 12.4 | P37: 7.5 | Q37: 86035996.09 | R37: 4538999.939 | S37: 123.6631 | T37: 28.404 | U37: 12.37 | V37: 2.84 | W37: 241.5 | X37: 29.25 | Y37: 573573.3073 | Z37: 64842.8563 | AA37: ISMB300
I38: 30 | J38: ISMB350 | K38: 52.4 | L38: 6670.9999 | M38: 350 | N38: 140 | O38: 14.2 | P38: 8.1 | Q38: 136302998.05 | R38: 5377000.122 | S38: 142.9411 | T38: 28.3906 | U38: 14.29 | V38: 2.84 | W38: 288 | X38: 31 | Y38: 778874.2746 | Z38: 76814.2875 | AA38: ISMB350
A39: Delta calculated | B39: of:=(5*[.C5]*([.C2]*[.C2]*[.C2]*[.C2]))/(384*[.G3]*[.B27]) -> 15.5938492036043 | C39: of:=IF([.B39]<[.B37];"safe";"un safe" ) -> un safe | E39: of:=(5*[.C5]*([.C2]*[.C2]*[.C2]*[.C2]))/(384*[.G3]*[.E27]) -> 11.4308957852366 | F39: of:=IF([.E39]<[.B37];"safe";"un safe" ) -> safe | I39: 31 | J39: ISMB400 | K39: 61.6 | L39: 7845.9999 | M39: 400 | N39: 140 | O39: 16 | P39: 8.9 | Q39: 204584003.91 | R39: 6220999.756 | S39: 161.4774 | T39: 28.1583 | U39: 16.15 | V39: 2.82 | W39: 334.4 | X39: 32.8 | Y39: 1022920.0195 | Z39: 88871.4251 | AA39: ISMB400
I40: 32 | J40: ISMB450 | K40: 72.4 | L40: 9226.9997 | M40: 450 | N40: 150 | O40: 17.4 | P40: 9.4 | Q40: 303908007.81 | R40: 8340000 | S40: 181.485 | T40: 30.0644 | U40: 18.15 | V40: 3.01 | W40: 379.2 | X40: 35.4 | Y40: 1350702.2569 | Z40: 111200 | AA40: ISMB450
I41: 33 | J41: ISMB500 | K41: 86.9 | L41: 11073.9998 | M41: 500 | N41: 180 | O41: 17.2 | P41: 10.2 | Q41: 452183007.8 | R41: 13698000.488 | S41: 202.0714 | T41: 35.1703 | U41: 20.21 | V41: 3.52 | W41: 424.1 | X41: 37.95 | Y41: 1808732.0313 | Z41: 152200.0054 | AA41: ISMB500
A42: CHECK FOR CRIPLING | I42: 34 | J42: ISMB550 | K42: 103.7 | L42: 13211.0001 | M42: 550 | N42: 190 | O42: 19.3 | P42: 11.2 | Q42: 648936015.6 | R42: 18338000.488 | S42: 221.6323 | T42: 37.257 | U42: 22.16 | V42: 3.73 | W42: 467.5 | X42: 41.25 | Y42: 2359767.3295 | Z42: 193031.5841 | AA42: ISMB550
I43: 35 | J43: ISMB600 | K43: 122.6 | L43: 15621.0007 | M43: 600 | N43: 210 | O43: 20.8 | P43: 12 | Q43: 918130000 | R43: 26510000 | S43: 242.4363 | T43: 41.1956 | U43: 24.24 | V43: 4.12 | W43: 509.7 | X43: 45.15 | Y43: 3060433.3333 | Z43: 252476.1905 | AA43: ISMB600
A44: ASSUME BEARING LENGTH (b) | C44: 100 | D44: mm | I44: 36 | J44: ISWB150 | K44: 17 | L44: 2167 | M44: 150 | N44: 100 | O44: 7 | P44: 5.4 | Q44: 8390999.756 | R44: 948000.0305 | S44: 62.2268 | T44: 20.9158 | U44: 6.22 | V44: 2.09 | W44: 116.6 | X44: 16.7 | Y44: 111879.9967 | Z44: 18960.0006 | AA44: ISWB150
I45: 37 | J45: ISWB175 | K45: 22.1 | L45: 2811.0001 | M45: 175 | N45: 125 | O45: 7.4 | P45: 5.8 | Q45: 15094000.244 | R45: 1886000.061 | S45: 73.2777 | T45: 25.9024 | U45: 7.33 | V45: 2.59 | W45: 139.5 | X45: 17.75 | Y45: 172502.8599 | Z45: 30176.001 | AA45: ISWB175
A46: SIGMA P | B46: of:=[.C9]/(([.C44]+([.B25]*1.73))*[.B24]) -> 55.7361237614676 | C46: of:=IF([.B46]<(0.75*[.C6]);"SAFE";"UN SAFE") -> SAFE | E46: of:=[.C9]/(([.C44]+([.E25]*1.73))*[.E24]) -> 52.1163830683688 | F46: of:=IF([.E46]<(0.75*[.C6]);"SAFE";"UN SAFE") -> SAFE | I46: 38 | J46: ISWB200 | K46: 28.8 | L46: 3670.9999 | M46: 200 | N46: 140 | O46: 9 | P46: 6.1 | Q46: 26245000 | R46: 3287999.878 | S46: 84.5534 | T46: 29.9277 | U46: 8.46 | V46: 2.99 | W46: 158.8 | X46: 20.6 | Y46: 262450 | Z46: 46971.4268 | AA46: ISWB200
I47: 39 | J47: ISWB225 | K47: 33.9 | L47: 4324.0002 | M47: 225 | N47: 150 | O47: 9.9 | P47: 6.4 | Q47: 39205000 | R47: 4486000.061 | S47: 95.2199 | T47: 32.2097 | U47: 9.52 | V47: 3.22 | W47: 181.4 | X47: 21.8 | Y47: 348488.8889 | Z47: 59813.3341 | AA47: ISWB225
I48: 40 | J48: ISWB250 | K48: 40.9 | L48: 5204.9999 | M48: 250 | N48: 200 | O48: 9 | P48: 6.7 | Q48: 59431000.98 | R48: 8575000 | S48: 106.8553 | T48: 40.5888 | U48: 10.69 | V48: 4.06 | W48: 203.8 | X48: 231 | Y48: 475448.0078 | Z48: 85750 | AA48: ISWB250
I49: 41 | J49: ISWB300 | K49: 48.1 | L49: 6133.0002 | M49: 300 | N49: 200 | O49: 10 | P49: 7.4 | Q49: 98215996.09 | R49: 9900999.756 | S49: 126.5478 | T49: 40.1794 | U49: 12.66 | V49: 4.02 | W49: 250.1 | X49: 24.95 | Y49: 654773.3073 | Z49: 99009.9976 | AA49: ISWB300
I50: 42 | J50: ISWB350 | K50: 56.9 | L50: 7250 | M50: 350 | N50: 200 | O50: 11.4 | P50: 8 | Q50: 155217001.95 | R50: 11759000.244 | S50: 146.319 | T50: 40.2732 | U50: 14.63 | V50: 4.03 | W50: 295.5 | X50: 27.25 | Y50: 886954.2969 | Z50: 117590.0024 | AA50: ISWB350
I51: 43 | J51: ISWB400 | K51: 66.7 | L51: 8501.0002 | M51: 400 | N51: 200 | O51: 13 | P51: 8.6 | Q51: 234266992.19 | R51: 13880000 | S51: 166.0048 | T51: 40.4073 | U51: 16.6 | V51: 4.04 | W51: 340.5 | X51: 29.75 | Y51: 1171334.9609 | Z51: 138800 | AA51: ISWB400
I52: 44 | J52: ISWB450 | K52: 79.4 | L52: 10115.0002 | M52: 450 | N52: 200 | O52: 15.4 | P52: 9.2 | Q52: 350576015.6 | R52: 17066999.512 | S52: 186.1693 | T52: 41.0767 | U52: 18.63 | V52: 4.11 | W52: 384 | X52: 33 | Y52: 1558115.625 | Z52: 170669.9951 | AA52: ISWB450
I53: 45 | J53: ISWB500 | K53: 95.2 | L53: 12122.0001 | M53: 500 | N53: 250 | O53: 14.7 | P53: 9.9 | Q53: 522908984.4 | R53: 29878000.488 | S53: 207.6949 | T53: 49.6465 | U53: 20.77 | V53: 4.96 | W53: 431 | X53: 34.5 | Y53: 2091635.9375 | Z53: 239024.0039 | AA53: ISWB500
I54: 46 | J54: ISWB550 | K54: 112.5 | L54: 14330.0003 | M54: 550 | N54: 250 | O54: 17.6 | P54: 10.5 | Q54: 749061015.6 | R54: 37406000.98 | S54: 228.6312 | T54: 51.0914 | U54: 22.86 | V54: 5.11 | W54: 473.4 | X54: 38.3 | Y54: 2723858.2386 | Z54: 299248.0078 | AA54: ISWB550
D55: FINAL SECTION | E55: of:=IF([.C39]="un safe";[.E20];[.B20]) -> ISLB300 | I55: 47 | J55: ISWB600-1 | K55: 133.7 | L55: 17038.0005 | M55: 600 | N55: 250 | O55: 21.3 | P55: 11.2 | Q55: 1061985000 | R55: 47025000 | S55: 249.6605 | T55: 52.5358 | U55: 24.97 | V55: 5.25 | W55: 514.2 | X55: 42.9 | Y55: 3539950 | Z55: 376200 | AA55: ISWB600-1
I56: 48 | J56: ISWB600-2 | K56: 1451 | L56: 18486.0001 | M56: 600 | N56: 250 | O56: 23.6 | P56: 11.8 | Q56: 1156266015.6 | R56: 52982998.05 | S56: 250.0964 | T56: 53.5361 | U56: 25.01 | V56: 5.35 | W56: 507.9 | X56: 46.05 | Y56: 3854220.052 | Z56: 423863.9844 | AA56: ISWB600-2
J70: ISHB150-1 | K70: 27.1 | L70: 3448 | M70: 150 | N70: 150 | O70: 9 | P70: 5.4 | Q70: 14555999.756 | R70: 4317000.122 | S70: 64.9737 | T70: 35.384 | U70: 6.5 | V70: 3.54 | W70: 112 | X70: 19 | Y70: 194079.9967 | Z70: 57560.0016 | AA70: ISHB150-1
J71: ISHB150-2 | K71: 30.6 | L71: 3898 | M71: 150 | N71: 150 | O71: 9 | P71: 8.4 | Q71: 15400000 | R71: 4802999.878 | S71: 62.8549 | T71: 35.1023 | U71: 6.29 | V71: 3.44 | W71: 112 | X71: 19 | Y71: 205333.3333 | Z71: 64039.9984 | AA71: ISHB150-2
J72: ISHB150-3 | K72: 34.6 | L72: 4408.0002 | M72: 150 | N72: 150 | O72: 9 | P72: 11.8 | Q72: 16355999.756 | R72: 4948999.939 | S72: 60.9141 | T72: 33.5072 | U72: 6.09 | V72: 3.35 | W72: 112 | X72: 19 | Y72: 218079.9967 | Z72: 65986.6659 | AA72: ISHB150-3
J73: ISHB200-1 | K73: 37.3 | L73: 4754.0001 | M73: 200 | N73: 200 | O73: 9 | P73: 6.1 | Q73: 36083999.02 | R73: 9670999.756 | S73: 87.122 | T73: 45.1031 | U73: 8.71 | V73: 4.51 | W73: 158.4 | X73: 20.8 | Y73: 360839.9902 | Z73: 96709.9976 | AA73: ISHB200-1
J74: ISHB200-2 | K74: 40 | L74: 5093.9999 | M74: 200 | N74: 200 | O74: 9 | P74: 7.8 | Q74: 37218000.49 | R74: 9945999.756 | S74: 85.4766 | T74: 44.187 | U74: 8.55 | V74: 4.42 | W74: 158.4 | X74: 20.8 | Y74: 372180.0049 | Z74: 99459.9976 | AA74: ISHB200-2
J75: ISHB225-1 | K75: 43.1 | L75: 5493.9999 | M75: 225 | N75: 225 | O75: 9.1 | P75: 6.5 | Q75: 52795000 | R75: 13538000.488 | S75: 98.0284 | T75: 49.6401 | U75: 9.8 | V75: 4.96 | W75: 180.5 | X75: 22.2 | Y75: 469288.8889 | Z75: 120337.7821 | AA75: ISHB225-1
J76: ISHB225-2 | K76: 46.8 | L76: 5966 | M76: 225 | N76: 225 | O76: 9.1 | P76: 8.6 | Q76: 54787998.05 | R76: 13965999.756 | S76: 95.8299 | T76: 48.3832 | U76: 9.58 | V76: 4.84 | W76: 180.5 | X76: 22.2 | Y76: 487004.4271 | Z76: 124142.2201 | AA76: ISHB225-2
J77: ISHB250-1 | K77: 51 | L77: 6495.9999 | M77: 250 | N77: 250 | O77: 9.7 | P77: 6.9 | Q77: 77365000 | R77: 19613000.488 | S77: 109.1313 | T77: 54.9476 | U77: 10.91 | V77: 5.49 | W77: 203.5 | X77: 23.2 | Y77: 618920 | Z77: 156904.0039 | AA77: ISHB250-1
J78: ISHB250-2 | K78: 54.7 | L78: 6970.9999 | M78: 250 | N78: 250 | O78: 9.7 | P78: 8.8 | Q78: 79838999.02 | R78: 20116999.512 | S78: 107.0188 | T78: 53.7198 | U78: 10.7 | V78: 5.37 | W78: 203.5 | X78: 23.2 | Y78: 638711.9922 | Z78: 160935.9961 | AA78: ISHB250-2
J79: ISHB300-1 | K79: 58.8 | L79: 7484.9998 | M79: 300 | N79: 250 | O79: 10.6 | P79: 7.6 | Q79: 125452001.95 | R79: 21936000.977 | S79: 129.4622 | T79: 54.1356 | U79: 12.95 | V79: 5.41 | W79: 249.8 | X79: 25.1 | Y79: 836346.6797 | Z79: 175488.0078 | AA79: ISHB300-1
J80: ISHB300-2 | K80: 63 | L80: 8025 | M80: 300 | N80: 250 | O80: 10.6 | P80: 9.4 | Q80: 129502001.95 | R80: 22466999.512 | S80: 127.0328 | T80: 52.9115 | U80: 12.7 | V80: 5.29 | W80: 249.8 | X80: 25.1 | Y80: 863346.6797 | Z80: 179735.9961 | AA80: ISHB300-2
J81: ISHB350-1 | K81: 67.4 | L81: 8591.0004 | M81: 350 | N81: 250 | O81: 11.6 | P81: 8.3 | Q81: 191596992.19 | R81: 24513999.023 | S81: 149.3387 | T81: 53.4177 | U81: 14.93 | V81: 5.34 | W81: 296 | X81: 27 | Y81: 1094839.9554 | Z81: 196111.9922 | AA81: ISHB350-1
J82: ISHB350-2 | K82: 72.4 | L82: 9220.9999 | M82: 350 | N82: 250 | O82: 11.6 | P82: 10.1 | Q82: 198028007.81 | R82: 25105000 | S82: 146.5461 | T82: 52.1784 | U82: 14.65 | V82: 5.22 | W82: 296 | X82: 27 | Y82: 1131588.6161 | Z82: 200840 | AA82: ISHB350-2
J83: ISHB400-1 | K83: 77.4 | L83: 9866.0004 | M83: 400 | N83: 250 | O83: 12.7 | P83: 9.1 | Q83: 280835000 | R83: 27283000.488 | S83: 168.7155 | T83: 52.5866 | U83: 16.87 | V83: 5.26 | W83: 340.1 | X83: 29.9 | Y83: 1404175 | Z83: 218264.0039 | AA83: ISHB400-1
J84: ISHB400-2 | K84: 82.2 | L84: 10466.0004 | M84: 400 | N84: 250 | O84: 12.7 | P84: 10.6 | Q84: 288235000 | R84: 27830000 | S84: 165.9522 | T84: 51.5663 | U84: 16.61 | V84: 5.16 | W84: 340.1 | X84: 29.9 | Y84: 1441175 | Z84: 222640 | AA84: ISHB400-2
J85: ISHB450-1 | K85: 87.2 | L85: 11113.9999 | M85: 450 | N85: 250 | O85: 13.7 | P85: 9.8 | Q85: 392108007.8 | R85: 29651999.512 | S85: 187.8312 | T85: 51.6526 | U85: 18.78 | V85: 5.18 | W85: 386.2 | X85: 31.9 | Y85: 1742702.2569 | Z85: 237215.9961 | AA85: ISHB450-1
J86: ISHB450-2 | K86: 92.5 | L86: 11788.9999 | M86: 450 | N86: 250 | O86: 13.7 | P86: 11.3 | Q86: 403498984.4 | R86: 30450000 | S86: 185.0047 | T86: 50.8224 | U86: 18.5 | V86: 5.08 | W86: 386.2 | X86: 31.9 | Y86: 1793328.8194 | Z86: 243600 | AA86: ISHB450-2

Sheet: Sheet2
B3: Section Name | C3: Sectional Area mm2 | D3: Depth mm | E3: Width of flange mm | F3: Thickness of flange mm | G3: Thickness of web mm | H3: Ixx | I3: Iyy | J3: rxx | K3: ryy | L3: Zxx | M3: Zyy | N3: Radius of root r1 | O3: Radius of toe r2 | P3: h1 | Q3: h2
B5: ISHB150-1 | C5: 3448 | D5: 150 | E5: 150 | F5: 9 | G5: 5.4 | H5: 14555999.756 | I5: 4317000.122 | J5: 64.9737 | K5: 35.384 | L5: 194079.9967 | M5: 57560.0016
B6: ISHB150-2 | C6: 3898 | D6: 150 | E6: 150 | F6: 9 | G6: 8.4 | H6: 15400000 | I6: 4802999.878 | J6: 62.8549 | K6: 35.1023 | L6: 205333.3333 | M6: 64039.9984
B7: ISHB150-3 | C7: 4408.0002 | D7: 150 | E7: 150 | F7: 9 | G7: 11.8 | H7: 16355999.756 | I7: 4948999.939 | J7: 60.9141 | K7: 33.5072 | L7: 218079.9967 | M7: 65986.6659
B8: ISHB200-1 | C8: 4754.0001 | D8: 200 | E8: 200 | F8: 9 | G8: 6.1 | H8: 36083999.02 | I8: 9670999.756 | J8: 87.122 | K8: 45.1031 | L8: 360839.9902 | M8: 96709.9976
B9: ISHB200-2 | C9: 5093.9999 | D9: 200 | E9: 200 | F9: 9 | G9: 7.8 | H9: 37218000.49 | I9: 9945999.756 | J9: 85.4766 | K9: 44.187 | L9: 372180.0049 | M9: 99459.9976
B10: ISHB225-1 | C10: 5493.9999 | D10: 225 | E10: 225 | F10: 9.1 | G10: 6.5 | H10: 52795000 | I10: 13538000.488 | J10: 98.0284 | K10: 49.6401 | L10: 469288.8889 | M10: 120337.7821
B11: ISHB225-2 | C11: 5966 | D11: 225 | E11: 225 | F11: 9.1 | G11: 8.6 | H11: 54787998.05 | I11: 13965999.756 | J11: 95.8299 | K11: 48.3832 | L11: 487004.4271 | M11: 124142.2201
B12: ISHB250-1 | C12: 6495.9999 | D12: 250 | E12: 250 | F12: 9.7 | G12: 6.9 | H12: 77365000 | I12: 19613000.488 | J12: 109.1313 | K12: 54.9476 | L12: 618920 | M12: 156904.0039
B13: ISHB250-2 | C13: 6970.9999 | D13: 250 | E13: 250 | F13: 9.7 | G13: 8.8 | H13: 79838999.02 | I13: 20116999.512 | J13: 107.0188 | K13: 53.7198 | L13: 638711.9922 | M13: 160935.9961
B14: ISHB300-1 | C14: 7484.9998 | D14: 300 | E14: 250 | F14: 10.6 | G14: 7.6 | H14: 125452001.95 | I14: 21936000.977 | J14: 129.4622 | K14: 54.1356 | L14: 836346.6797 | M14: 175488.0078
B15: ISHB300-2 | C15: 8025 | D15: 300 | E15: 250 | F15: 10.6 | G15: 9.4 | H15: 129502001.95 | I15: 22466999.512 | J15: 127.0328 | K15: 52.9115 | L15: 863346.6797 | M15: 179735.9961
B16: ISHB350-1 | C16: 8591.0004 | D16: 350 | E16: 250 | F16: 11.6 | G16: 8.3 | H16: 191596992.19 | I16: 24513999.023 | J16: 149.3387 | K16: 53.4177 | L16: 1094839.9554 | M16: 196111.9922
B17: ISHB350-2 | C17: 9220.9999 | D17: 350 | E17: 250 | F17: 11.6 | G17: 10.1 | H17: 198028007.81 | I17: 25105000 | J17: 146.5461 | K17: 52.1784 | L17: 1131588.6161 | M17: 200840
B18: ISHB400-1 | C18: 9866.0004 | D18: 400 | E18: 250 | F18: 12.7 | G18: 9.1 | H18: 280835000 | I18: 27283000.488 | J18: 168.7155 | K18: 52.5866 | L18: 1404175 | M18: 218264.0039
B19: ISHB400-2 | C19: 10466.0004 | D19: 400 | E19: 250 | F19: 12.7 | G19: 10.6 | H19: 288235000 | I19: 27830000 | J19: 165.9522 | K19: 51.5663 | L19: 1441175 | M19: 222640
B20: ISHB450-1 | C20: 11113.9999 | D20: 450 | E20: 250 | F20: 13.7 | G20: 9.8 | H20: 392108007.8 | I20: 29651999.512 | J20: 187.8312 | K20: 51.6526 | L20: 1742702.2569 | M20: 237215.9961
B21: ISHB450-2 | C21: 11788.9999 | D21: 450 | E21: 250 | F21: 13.7 | G21: 11.3 | H21: 403498984.4 | I21: 30450000 | J21: 185.0047 | K21: 50.8224 | L21: 1793328.8194 | M21: 243600
B22: ISJB150 | C22: 901 | D22: 150 | E22: 50 | F22: 4.6 | G22: 3 | H22: 3221000.061 | I22: 91999.9981 | J22: 59.7906 | K22: 10.1049 | L22: 42946.6675 | M22: 3679.9999
B23: ISJB175 | C23: 1028 | D23: 175 | E23: 50 | F23: 4.8 | G23: 3.2 | H23: 4792999.878 | I23: 96999.9981 | J23: 68.2821 | K23: 9.7138 | L23: 54777.1415 | M23: 3879.9999
B24: ISJB200 | C24: 1264 | D24: 200 | E24: 60 | F24: 5 | G24: 3.4 | H24: 7807000.122 | I24: 172999.9924 | J24: 78.5902 | K24: 11.699 | L24: 78070.0012 | M24: 5766.6664
B25: ISJB225 | C25: 1628.0001 | D25: 225 | E25: 80 | F25: 5 | G25: 3.7 | H25: 13085000 | I25: 405000 | J25: 89.6519 | K25: 15.7725 | L25: 116311.1111 | M25: 10125
B26: ISLB100 | C26: 1021 | D26: 100 | E26: 50 | F26: 6.4 | G26: 4 | H26: 1680000 | I26: 126999.9981 | J26: 40.5641 | K26: 11.1529 | L26: 33600 | M26: 5079.9999
B27: ISLB125 | C27: 1512 | D27: 125 | E27: 75 | F27: 6.5 | G27: 4.4 | H27: 4067999.878 | I27: 434000.0153 | J27: 51.8698 | K27: 16.9422 | L27: 65087.998 | M27: 11573.3337
B28: ISLB150 | C28: 1808 | D28: 150 | E28: 80 | F28: 6.8 | G28: 4.8 | H28: 6882000.122 | I28: 552000.0076 | J28: 61.6962 | K28: 17.4731 | L28: 91760.0016 | M28: 13800.0002
B29: ISLB175 | C29: 2129.9999 | D29: 175 | E29: 90 | F29: 6.9 | G29: 5.1 | H29: 10961999.512 | I29: 795999.9847 | J29: 71.739 | K29: 19.3316 | L29: 125279.9944 | M29: 17688.8885
B30: ISLB200 | C30: 2527 | D30: 200 | E30: 100 | F30: 7.3 | G30: 5.4 | H30: 16965999.756 | I30: 1154000.0153 | J30: 81.9383 | K30: 21.3698 | L30: 169659.9976 | M30: 23080.0003
B31: ISLB225 | C31: 2992 | D31: 225 | E31: 100 | F31: 8.6 | G31: 5.8 | H31: 25018999.023 | I31: 1126999.9695 | J31: 91.4438 | K31: 19.408 | L31: 222391.1024 | M31: 22539.9994
B32: ISLB250 | C32: 3552.9999 | D32: 250 | E32: 125 | F32: 8.2 | G32: 6.1 | H32: 37178000.49 | I32: 1933999.939 | J32: 102.2929 | K32: 23.3309 | L32: 297424.0039 | M32: 30943.999
B33: ISLB275 | C33: 4202 | D33: 275 | E33: 140 | F33: 8.8 | G33: 6.4 | H33: 53752998.05 | I33: 2870000 | J33: 113.1028 | K33: 26.1344 | L33: 390930.8949 | M33: 41000
B34: ISLB300 | C34: 4808.0002 | D34: 300 | E34: 150 | F34: 9.4 | G34: 6.7 | H34: 73328999.02 | I34: 3762000.122 | J34: 123.4968 | K34: 27.9722 | L34: 488859.9935 | M34: 50160.0016
B35: ISLB325 | C35: 5490.0002 | D35: 325 | E35: 165 | F35: 9.8 | G35: 7 | H35: 98745996.09 | I35: 5107999.878 | J35: 134.1138 | K35: 30.5028 | L35: 607667.6683 | M35: 61915.15
B36: ISLB350 | C36: 6300.9998 | D36: 350 | E36: 165 | F36: 11.4 | G36: 7.4 | H36: 131582998.05 | I36: 6319000.244 | J36: 144.5091 | K36: 31.6679 | L36: 751902.846 | M36: 76593.9424
B37: ISLB400 | C37: 7243 | D37: 400 | E37: 165 | F37: 12.5 | G37: 8 | H37: 193063007.81 | I37: 7164000.244 | J37: 163.2639 | K37: 31.4498 | L37: 965315.0391 | M37: 86836.3666
B38: ISLB450 | C38: 8313.9999 | D38: 450 | E38: 170 | F38: 13.4 | G38: 8.6 | H38: 275360996.09 | I38: 8530000 | J38: 181.9894 | K38: 32.0309 | L38: 1223826.6493 | M38: 100352.9412
B39: ISLB500 | C39: 9550 | D39: 500 | E39: 180 | F39: 14.1 | G39: 9.2 | H39: 385790000 | I39: 10639000.244 | J39: 200.9897 | K39: 33.3771 | L39: 1543160 | M39: 118211.1138
B40: ISLB550 | C40: 10997.0001 | D40: 550 | E40: 190 | F40: 15 | G40: 9.9 | H40: 531616015.6 | I40: 13350999.756 | J40: 219.8679 | K40: 34.8433 | L40: 1933149.1477 | M40: 140536.8395
B41: ISLB600 | C41: 12669.0002 | D41: 600 | E41: 210 | F41: 15.5 | G41: 10.5 | H41: 728676015.6 | I41: 18219000.244 | J41: 239.8259 | K41: 37.922 | L41: 2428920.0521 | M41: 173514.288
B42: ISLB75 | C42: 771 | D42: 75 | E42: 50 | F42: 5 | G42: 3.7 | H42: 726999.9695 | I42: 100000 | J42: 30.7072 | K42: 11.3887 | L42: 19386.6659 | M42: 4000
B43: ISMB100 | C43: 1460 | D43: 100 | E43: 75 | F43: 7.2 | G43: 4 | H43: 2575000 | I43: 407999.9924 | J43: 41.9964 | K43: 16.7168 | L43: 51500 | M43: 10879.9998
B44: ISMB125 | C44: 1660 | D44: 125 | E44: 75 | F44: 7.6 | G44: 4.4 | H44: 4490000 | I44: 437000.0076 | J44: 52.0079 | K44: 16.2251 | L44: 71840 | M44: 11653.3335
B45: ISMB150 | C45: 1900 | D45: 150 | E45: 80 | F45: 7.6 | G45: 4.8 | H45: 7264000.244 | I45: 525999.9847 | J45: 61.8317 | K45: 16.6386 | L45: 96853.3366 | M45: 13149.9996
B46: ISMB175 | C46: 2462.0001 | D46: 175 | E46: 90 | F46: 8.6 | G46: 5.5 | H46: 12720000 | I46: 850000 | J46: 71.8786 | K46: 18.5808 | L46: 145371.4286 | M46: 18888.8889
B47: ISMB200 | C47: 3233.0002 | D47: 200 | E47: 100 | F47: 10.8 | G47: 5.7 | H47: 22353999.023 | I47: 1500000 | J47: 83.1524 | K47: 21.5399 | L47: 223539.9902 | M47: 30000
B48: ISMB225 | C48: 3972.0001 | D48: 225 | E48: 110 | F48: 11.8 | G48: 6.5 | H48: 34418000.49 | I48: 2183000.0305 | J48: 93.0868 | K48: 23.4435 | L48: 305937.7821 | M48: 39690.9096
B49: ISMB250 | C49: 4754.9999 | D49: 250 | E49: 125 | F49: 12.5 | G49: 6.9 | H49: 51316000.98 | I49: 3345000 | J49: 103.8846 | K49: 26.523 | L49: 410528.0078 | M49: 53520
B50: ISMB300 | C50: 5625.9998 | D50: 300 | E50: 140 | F50: 12.4 | G50: 7.5 | H50: 86035996.09 | I50: 4538999.939 | J50: 123.6631 | K50: 28.404 | L50: 573573.3073 | M50: 64842.8563
B51: ISMB350 | C51: 6670.9999 | D51: 350 | E51: 140 | F51: 14.2 | G51: 8.1 | H51: 136302998.05 | I51: 5377000.122 | J51: 142.9411 | K51: 28.3906 | L51: 778874.2746 | M51: 76814.2875
B52: ISMB400 | C52: 7845.9999 | D52: 400 | E52: 140 | F52: 16 | G52: 8.9 | H52: 204584003.91 | I52: 6220999.756 | J52: 161.4774 | K52: 28.1583 | L52: 1022920.0195 | M52: 88871.4251
B53: ISMB450 | C53: 9226.9997 | D53: 450 | E53: 150 | F53: 17.4 | G53: 9.4 | H53: 303908007.81 | I53: 8340000 | J53: 181.485 | K53: 30.0644 | L53: 1350702.2569 | M53: 111200
B54: ISMB500 | C54: 11073.9998 | D54: 500 | E54: 180 | F54: 17.2 | G54: 10.2 | H54: 452183007.8 | I54: 13698000.488 | J54: 202.0714 | K54: 35.1703 | L54: 1808732.0313 | M54: 152200.0054
B55: ISMB550 | C55: 13211.0001 | D55: 550 | E55: 190 | F55: 19.3 | G55: 11.2 | H55: 648936015.6 | I55: 18338000.488 | J55: 221.6323 | K55: 37.257 | L55: 2359767.3295 | M55: 193031.5841
B56: ISMB600 | C56: 15621.0007 | D56: 600 | E56: 210 | F56: 20.8 | G56: 12 | H56: 918130000 | I56: 26510000 | J56: 242.4363 | K56: 41.1956 | L56: 3060433.3333 | M56: 252476.1905
B57: ISWB150 | C57: 2167 | D57: 150 | E57: 100 | F57: 7 | G57: 5.4 | H57: 8390999.756 | I57: 948000.0305 | J57: 62.2268 | K57: 20.9158 | L57: 111879.9967 | M57: 18960.0006
B58: ISWB175 | C58: 2811.0001 | D58: 175 | E58: 125 | F58: 7.4 | G58: 5.8 | H58: 15094000.244 | I58: 1886000.061 | J58: 73.2777 | K58: 25.9024 | L58: 172502.8599 | M58: 30176.001
B59: ISWB200 | C59: 3670.9999 | D59: 200 | E59: 140 | F59: 9 | G59: 6.1 | H59: 26245000 | I59: 3287999.878 | J59: 84.5534 | K59: 29.9277 | L59: 262450 | M59: 46971.4268
B60: ISWB225 | C60: 4324.0002 | D60: 225 | E60: 150 | F60: 9.9 | G60: 6.4 | H60: 39205000 | I60: 4486000.061 | J60: 95.2199 | K60: 32.2097 | L60: 348488.8889 | M60: 59813.3341
B61: ISWB250 | C61: 5204.9999 | D61: 250 | E61: 200 | F61: 9 | G61: 6.7 | H61: 59431000.98 | I61: 8575000 | J61: 106.8553 | K61: 40.5888 | L61: 475448.0078 | M61: 85750
B62: ISWB300 | C62: 6133.0002 | D62: 300 | E62: 200 | F62: 10 | G62: 7.4 | H62: 98215996.09 | I62: 9900999.756 | J62: 126.5478 | K62: 40.1794 | L62: 654773.3073 | M62: 99009.9976
B63: ISWB350 | C63: 7250 | D63: 350 | E63: 200 | F63: 11.4 | G63: 8 | H63: 155217001.95 | I63: 11759000.244 | J63: 146.319 | K63: 40.2732 | L63: 886954.2969 | M63: 117590.0024
B64: ISWB400 | C64: 8501.0002 | D64: 400 | E64: 200 | F64: 13 | G64: 8.6 | H64: 234266992.19 | I64: 13880000 | J64: 166.0048 | K64: 40.4073 | L64: 1171334.9609 | M64: 138800
B65: ISWB450 | C65: 10115.0002 | D65: 450 | E65: 200 | F65: 15.4 | G65: 9.2 | H65: 350576015.6 | I65: 17066999.512 | J65: 186.1693 | K65: 41.0767 | L65: 1558115.625 | M65: 170669.9951
B66: ISWB500 | C66: 12122.0001 | D66: 500 | E66: 250 | F66: 14.7 | G66: 9.9 | H66: 522908984.4 | I66: 29878000.488 | J66: 207.6949 | K66: 49.6465 | L66: 2091635.9375 | M66: 239024.0039
B67: ISWB550 | C67: 14330.0003 | D67: 550 | E67: 250 | F67: 17.6 | G67: 10.5 | H67: 749061015.6 | I67: 37406000.98 | J67: 228.6312 | K67: 51.0914 | L67: 2723858.2386 | M67: 299248.0078
B68: ISWB600-1 | C68: 17038.0005 | D68: 600 | E68: 250 | F68: 21.3 | G68: 11.2 | H68: 1061985000 | I68: 47025000 | J68: 249.6605 | K68: 52.5358 | L68: 3539950 | M68: 376200
B69: ISWB600-2 | C69: 18486.0001 | D69: 600 | E69: 250 | F69: 23.6 | G69: 11.8 | H69: 1156266015.6 | I69: 52982998.05 | J69: 250.0964 | K69: 53.5361 | L69: 3854220.052 | M69: 423863.9844

Sheet: Sheet3
B2: Section Name | C2: Weight per Meter Kg | D2: Sectional Area mm2 | E2: Depth mm | F2: Width of flange mm | G2: Thickness of flange mm | H2: Thickness of web mm | I2: Ixx | J2: Iyy | K2: rxx | L2: ryy | M2: Radius of root r1 | N2: Radius of toe r2 | O2: h1 | P2: h2 | Q2: Zxx | R2: Zyy | S2: Section Name
B4: ISLB75 | C4: 6.1 | D4: 771 | E4: 75 | F4: 50 | G4: 5 | H4: 3.7 | I4: 726999.9695 | J4: 100000 | K4: 30.7072 | L4: 11.3887 | M4: 3.07 | N4: 1.14 | O4: 51.7 | P4: 11.65 | Q4: 19386.6659 | R4: 4000 | S4: ISLB75
B5: ISLB100 | C5: 8 | D5: 1021 | E5: 100 | F5: 50 | G5: 6.4 | H5: 4 | I5: 1680000 | J5: 126999.9981 | K5: 40.5641 | L5: 11.1529 | M5: 4.06 | N5: 1.12 | O5: 73 | P5: 13.5 | Q5: 33600 | R5: 5079.9999 | S5: ISLB100
B6: ISJB150 | C6: 7.1 | D6: 901 | E6: 150 | F6: 50 | G6: 4.6 | H6: 3 | I6: 3221000.061 | J6: 91999.9981 | K6: 59.7906 | L6: 10.1049 | M6: 5.98 | N6: 1.01 | O6: 130.4 | P6: 9.8 | Q6: 42946.6675 | R6: 3679.9999 | S6: ISJB150
B7: ISMB100 | C7: 11.5 | D7: 1460 | E7: 100 | F7: 75 | G7: 7.2 | H7: 4 | I7: 2575000 | J7: 407999.9924 | K7: 41.9964 | L7: 16.7168 | M7: 4.2 | N7: 1.67 | O7: 65 | P7: 17.5 | Q7: 51500 | R7: 10879.9998 | S7: ISMB100
B8: ISJB175 | C8: 8.1 | D8: 1028 | E8: 175 | F8: 50 | G8: 4.8 | H8: 3.2 | I8: 4792999.878 | J8: 96999.9981 | K8: 68.2821 | L8: 9.7138 | M8: 6.83 | N8: 0.97 | O8: 155 | P8: 10 | Q8: 54777.1415 | R8: 3879.9999 | S8: ISJB175
B9: ISLB125 | C9: 11.9 | D9: 1512 | E9: 125 | F9: 75 | G9: 6.5 | H9: 4.4 | I9: 4067999.878 | J9: 434000.0153 | K9: 51.8698 | L9: 16.9422 | M9: 5.19 | N9: 1.69 | O9: 95.4 | P9: 14.8 | Q9: 65087.998 | R9: 11573.3337 | S9: ISLB125
B10: ISMB125 | C10: 13 | D10: 1660 | E10: 125 | F10: 75 | G10: 7.6 | H10: 4.4 | I10: 4490000 | J10: 437000.0076 | K10: 52.0079 | L10: 16.2251 | M10: 5.2 | N10: 1.62 | O10: 89.2 | P10: 17.9 | Q10: 71840 | R10: 11653.3335 | S10: ISMB125
B11: ISJB200 | C11: 9.9 | D11: 1264 | E11: 200 | F11: 60 | G11: 5 | H11: 3.4 | I11: 7807000.122 | J11: 172999.9924 | K11: 78.5902 | L11: 11.699 | M11: 7.86 | N11: 1.17 | O11: 179.5 | P11: 10.25 | Q11: 78070.0012 | R11: 5766.6664 | S11: ISJB200
B12: ISLB150 | C12: 14.2 | D12: 1808 | E12: 150 | F12: 80 | G12: 6.8 | H12: 4.8 | I12: 6882000.122 | J12: 552000.0076 | K12: 61.6962 | L12: 17.4731 | M12: 6.17 | N12: 1.75 | O12: 116.9 | P12: 16.55 | Q12: 91760.0016 | R12: 13800.0002 | S12: ISLB150
B13: ISMB150 | C13: 14.9 | D13: 1900 | E13: 150 | F13: 80 | G13: 7.6 | H13: 4.8 | I13: 7264000.244 | J13: 525999.9847 | K13: 61.8317 | L13: 16.6386 | M13: 6.18 | N13: 1.66 | O13: 113.9 | P13: 18.05 | Q13: 96853.3366 | R13: 13149.9996 | S13: ISMB150
B14: ISWB150 | C14: 17 | D14: 2167 | E14: 150 | F14: 100 | G14: 7 | H14: 5.4 | I14: 8390999.756 | J14: 948000.0305 | K14: 62.2268 | L14: 20.9158 | M14: 6.22 | N14: 2.09 | O14: 116.6 | P14: 16.7 | Q14: 111879.9967 | R14: 18960.0006 | S14: ISWB150
B15: ISJB225 | C15: 12.8 | D15: 1628.0001 | E15: 225 | F15: 80 | G15: 5 | H15: 3.7 | I15: 13085000 | J15: 405000 | K15: 89.6519 | L15: 15.7725 | M15: 8.97 | N15: 1.58 | O15: 201.1 | P15: 11.95 | Q15: 116311.1111 | R15: 10125 | S15: ISJB225
B16: ISLB175 | C16: 16.7 | D16: 2129.9999 | E16: 175 | F16: 90 | G16: 6.9 | H16: 5.1 | I16: 10961999.512 | J16: 795999.9847 | K16: 71.739 | L16: 19.3316 | M16: 7.17 | N16: 1.93 | O16: 141.6 | P16: 16.7 | Q16: 125279.9944 | R16: 17688.8885 | S16: ISLB175
B17: ISMB175 | C17: 19.3 | D17: 2462.0001 | E17: 175 | F17: 90 | G17: 8.6 | H17: 5.5 | I17: 12720000 | J17: 850000 | K17: 71.8786 | L17: 18.5808 | M17: 7.19 | N17: 1.86 | O17: 134.5 | P17: 20.25 | Q17: 145371.4286 | R17: 18888.8889 | S17: ISMB175
B18: ISLB200 | C18: 19.8 | D18: 2527 | E18: 200 | F18: 100 | G18: 7.3 | H18: 5.4 | I18: 16965999.756 | J18: 1154000.0153 | K18: 81.9383 | L18: 21.3698 | M18: 8.19 | N18: 2.13 | O18: 165.7 | P18: 17.15 | Q18: 169659.9976 | R18: 23080.0003 | S18: ISLB200
B19: ISWB175 | C19: 22.1 | D19: 2811.0001 | E19: 175 | F19: 125 | G19: 7.4 | H19: 5.8 | I19: 15094000.244 | J19: 1886000.061 | K19: 73.2777 | L19: 25.9024 | M19: 7.33 | N19: 2.59 | O19: 139.5 | P19: 17.75 | Q19: 172502.8599 | R19: 30176.001 | S19: ISWB175
B20: ISHB150-1 | C20: 27.1 | D20: 3448 | E20: 150 | F20: 150 | G20: 9 | H20: 5.4 | I20: 14555999.756 | J20: 4317000.122 | K20: 64.9737 | L20: 35.384 | M20: 6.5 | N20: 3.54 | O20: 112 | P20: 19 | Q20: 194079.9967 | R20: 57560.0016 | S20: ISHB150-1
B21: ISHB150-2 | C21: 30.6 | D21: 3898 | E21: 150 | F21: 150 | G21: 9 | H21: 8.4 | I21: 15400000 | J21: 4802999.878 | K21: 62.8549 | L21: 35.1023 | M21: 6.29 | N21: 3.44 | O21: 112 | P21: 19 | Q21: 205333.3333 | R21: 64039.9984 | S21: ISHB150-2
B22: ISHB150-3 | C22: 34.6 | D22: 4408.0002 | E22: 150 | F22: 150 | G22: 9 | H22: 11.8 | I22: 16355999.756 | J22: 4948999.939 | K22: 60.9141 | L22: 33.5072 | M22: 6.09 | N22: 3.35 | O22: 112 | P22: 19 | Q22: 218079.9967 | R22: 65986.6659 | S22: ISHB150-3
B23: ISLB225 | C23: 23.5 | D23: 2992 | E23: 225 | F23: 100 | G23: 8.6 | H23: 5.8 | I23: 25018999.023 | J23: 1126999.9695 | K23: 91.4438 | L23: 19.408 | M23: 9.15 | N23: 1.94 | O23: 180.3 | P23: 22.35 | Q23: 222391.1024 | R23: 22539.9994 | S23: ISLB225
B24: ISMB200 | C24: 25.4 | D24: 3233.0002 | E24: 200 | F24: 100 | G24: 10.8 | H24: 5.7 | I24: 22353999.023 | J24: 1500000 | K24: 83.1524 | L24: 21.5399 | M24: 8.32 | N24: 2.15 | O24: 152.7 | P24: 23.65 | Q24: 223539.9902 | R24: 30000 | S24: ISMB200
B25: ISWB200 | C25: 28.8 | D25: 3670.9999 | E25: 200 | F25: 140 | G25: 9 | H25: 6.1 | I25: 26245000 | J25: 3287999.878 | K25: 84.5534 | L25: 29.9277 | M25: 8.46 | N25: 2.99 | O25: 158.8 | P25: 20.6 | Q25: 262450 | R25: 46971.4268 | S25: ISWB200
B26: ISLB250 | C26: 27.9 | D26: 3552.9999 | E26: 250 | F26: 125 | G26: 8.2 | H26: 6.1 | I26: 37178000.49 | J26: 1933999.939 | K26: 102.2929 | L26: 23.3309 | M26: 10.23 | N26: 2.33 | O26: 202.6 | P26: 23.7 | Q26: 297424.0039 | R26: 30943.999 | S26: ISLB250
B27: ISMB225 | C27: 31.2 | D27: 3972.0001 | E27: 225 | F27: 110 | G27: 11.8 | H27: 6.5 | I27: 34418000.49 | J27: 2183000.0305 | K27: 93.0868 | L27: 23.4435 | M27: 9.31 | N27: 2.34 | O27: 173.3 | P27: 25.85 | Q27: 305937.7821 | R27: 39690.9096 | S27: ISMB225
B28: ISWB225 | C28: 33.9 | D28: 4324.0002 | E28: 225 | F28: 150 | G28: 9.9 | H28: 6.4 | I28: 39205000 | J28: 4486000.061 | K28: 95.2199 | L28: 32.2097 | M28: 9.52 | N28: 3.22 | O28: 181.4 | P28: 21.8 | Q28: 348488.8889 | R28: 59813.3341 | S28: ISWB225
B29: ISHB200-1 | C29: 37.3 | D29: 4754.0001 | E29: 200 | F29: 200 | G29: 9 | H29: 6.1 | I29: 36083999.02 | J29: 9670999.756 | K29: 87.122 | L29: 45.1031 | M29: 8.71 | N29: 4.51 | O29: 158.4 | P29: 20.8 | Q29: 360839.9902 | R29: 96709.9976 | S29: ISHB200-1
B30: ISHB200-2 | C30: 40 | D30: 5093.9999 | E30: 200 | F30: 200 | G30: 9 | H30: 7.8 | I30: 37218000.49 | J30: 9945999.756 | K30: 85.4766 | L30: 44.187 | M30: 8.55 | N30: 4.42 | O30: 158.4 | P30: 20.8 | Q30: 372180.0049 | R30: 99459.9976 | S30: ISHB200-2
B31: ISLB275 | C31: 33 | D31: 4202 | E31: 275 | F31: 140 | G31: 8.8 | H31: 6.4 | I31: 53752998.05 | J31: 2870000 | K31: 113.1028 | L31: 26.1344 | M31: 11.31 | N31: 2.61 | O31: 223.7 | P31: 25.65 | Q31: 390930.8949 | R31: 41000 | S31: ISLB275
B32: ISMB250 | C32: 37.3 | D32: 4754.9999 | E32: 250 | F32: 125 | G32: 12.5 | H32: 6.9 | I32: 51316000.98 | J32: 3345000 | K32: 103.8846 | L32: 26.523 | M32: 10.39 | N32: 2.65 | O32: 194.1 | P32: 27.95 | Q32: 410528.0078 | R32: 53520 | S32: ISMB250
B33: ISHB225-1 | C33: 43.1 | D33: 5493.9999 | E33: 225 | F33: 225 | G33: 9.1 | H33: 6.5 | I33: 52795000 | J33: 13538000.488 | K33: 98.0284 | L33: 49.6401 | M33: 9.8 | N33: 4.96 | O33: 180.5 | P33: 22.2 | Q33: 469288.8889 | R33: 120337.7821 | S33: ISHB225-1
B34: ISWB250 | C34: 40.9 | D34: 5204.9999 | E34: 250 | F34: 200 | G34: 9 | H34: 6.7 | I34: 59431000.98 | J34: 8575000 | K34: 106.8553 | L34: 40.5888 | M34: 10.69 | N34: 4.06 | O34: 203.8 | P34: 231 | Q34: 475448.0078 | R34: 85750 | S34: ISWB250
B35: ISHB225-2 | C35: 46.8 | D35: 5966 | E35: 225 | F35: 225 | G35: 9.1 | H35: 8.6 | I35: 54787998.05 | J35: 13965999.756 | K35: 95.8299 | L35: 48.3832 | M35: 9.58 | N35: 4.84 | O35: 180.5 | P35: 22.2 | Q35: 487004.4271 | R35: 124142.2201 | S35: ISHB225-2
B36: ISLB300 | C36: 37.7 | D36: 4808.0002 | E36: 300 | F36: 150 | G36: 9.4 | H36: 6.7 | I36: 73328999.02 | J36: 3762000.122 | K36: 123.4968 | L36: 27.9722 | M36: 12.35 | N36: 2.8 | O36: 245.1 | P36: 27.45 | Q36: 488859.9935 | R36: 50160.0016 | S36: ISLB300
B37: ISMB300 | C37: 44.2 | D37: 5625.9998 | E37: 300 | F37: 140 | G37: 12.4 | H37: 7.5 | I37: 86035996.09 | J37: 4538999.939 | K37: 123.6631 | L37: 28.404 | M37: 12.37 | N37: 2.84 | O37: 241.5 | P37: 29.25 | Q37: 573573.3073 | R37: 64842.8563 | S37: ISMB300
B38: ISLB325 | C38: 43.1 | D38: 5490.0002 | E38: 325 | F38: 165 | G38: 9.8 | H38: 7 | I38: 98745996.09 | J38: 5107999.878 | K38: 134.1138 | L38: 30.5028 | M38: 13.41 | N38: 3.05 | O38: 266.5 | P38: 29.25 | Q38: 607667.6683 | R38: 61915.15 | S38: ISLB325
B39: ISHB250-1 | C39: 51 | D39: 6495.9999 | E39: 250 | F39: 250 | G39: 9.7 | H39: 6.9 | I39: 77365000 | J39: 19613000.488 | K39: 109.1313 | L39: 54.9476 | M39: 10.91 | N39: 5.49 | O39: 203.5 | P39: 23.2 | Q39: 618920 | R39: 156904.0039 | S39: ISHB250-1
B40: ISHB250-2 | C40: 54.7 | D40: 6970.9999 | E40: 250 | F40: 250 | G40: 9.7 | H40: 8.8 | I40: 79838999.02 | J40: 20116999.512 | K40: 107.0188 | L40: 53.7198 | M40: 10.7 | N40: 5.37 | O40: 203.5 | P40: 23.2 | Q40: 638711.9922 | R40: 160935.9961 | S40: ISHB250-2
B41: ISWB300 | C41: 48.1 | D41: 6133.0002 | E41: 300 | F41: 200 | G41: 10 | H41: 7.4 | I41: 98215996.09 | J41: 9900999.756 | K41: 126.5478 | L41: 40.1794 | M41: 12.66 | N41: 4.02 | O41: 250.1 | P41: 24.95 | Q41: 654773.3073 | R41: 99009.9976 | S41: ISWB300
B42: ISLB350 | C42: 49.5 | D42: 6300.9998 | E42: 350 | F42: 165 | G42: 11.4 | H42: 7.4 | I42: 131582998.05 | J42: 6319000.244 | K42: 144.5091 | L42: 31.6679 | M42: 14.45 | N42: 3.17 | O42: 288.3 | P42: 30.85 | Q42: 751902.846 | R42: 76593.9424 | S42: ISLB350
B43: ISMB350 | C43: 52.4 | D43: 6670.9999 | E43: 350 | F43: 140 | G43: 14.2 | H43: 8.1 | I43: 136302998.05 | J43: 5377000.122 | K43: 142.9411 | L43: 28.3906 | M43: 14.29 | N43: 2.84 | O43: 288 | P43: 31 | Q43: 778874.2746 | R43: 76814.2875 | S43: ISMB350
B44: ISHB300-1 | C44: 58.8 | D44: 7484.9998 | E44: 300 | F44: 250 | G44: 10.6 | H44: 7.6 | I44: 125452001.95 | J44: 21936000.977 | K44: 129.4622 | L44: 54.1356 | M44: 12.95 | N44: 5.41 | O44: 249.8 | P44: 25.1 | Q44: 836346.6797 | R44: 175488.0078 | S44: ISHB300-1
B45: ISHB300-2 | C45: 63 | D45: 8025 | E45: 300 | F45: 250 | G45: 10.6 | H45: 9.4 | I45: 129502001.95 | J45: 22466999.512 | K45: 127.0328 | L45: 52.9115 | M45: 12.7 | N45: 5.29 | O45: 249.8 | P45: 25.1 | Q45: 863346.6797 | R45: 179735.9961 | S45: ISHB300-2
B46: ISWB350 | C46: 56.9 | D46: 7250 | E46: 350 | F46: 200 | G46: 11.4 | H46: 8 | I46: 155217001.95 | J46: 11759000.244 | K46: 146.319 | L46: 40.2732 | M46: 14.63 | N46: 4.03 | O46: 295.5 | P46: 27.25 | Q46: 886954.2969 | R46: 117590.0024 | S46: ISWB350
B47: ISLB400 | C47: 56.9 | D47: 7243 | E47: 400 | F47: 165 | G47: 12.5 | H47: 8 | I47: 193063007.81 | J47: 7164000.244 | K47: 163.2639 | L47: 31.4498 | M47: 16.33 | N47: 3.15 | O47: 336.2 | P47: 31.9 | Q47: 965315.0391 | R47: 86836.3666 | S47: ISLB400
B48: ISMB400 | C48: 61.6 | D48: 7845.9999 | E48: 400 | F48: 140 | G48: 16 | H48: 8.9 | I48: 204584003.91 | J48: 6220999.756 | K48: 161.4774 | L48: 28.1583 | M48: 16.15 | N48: 2.82 | O48: 334.4 | P48: 32.8 | Q48: 1022920.0195 | R48: 88871.4251 | S48: ISMB400
B49: ISHB350-1 | C49: 67.4 | D49: 8591.0004 | E49: 350 | F49: 250 | G49: 11.6 | H49: 8.3 | I49: 191596992.19 | J49: 24513999.023 | K49: 149.3387 | L49: 53.4177 | M49: 14.93 | N49: 5.34 | O49: 296 | P49: 27 | Q49: 1094839.9554 | R49: 196111.9922 | S49: ISHB350-1
B50: ISHB350-2 | C50: 72.4 | D50: 9220.9999 | E50: 350 | F50: 250 | G50: 11.6 | H50: 10.1 | I50: 198028007.81 | J50: 25105000 | K50: 146.5461 | L50: 52.1784 | M50: 14.65 | N50: 5.22 | O50: 296 | P50: 27 | Q50: 1131588.6161 | R50: 200840 | S50: ISHB350-2
B51: ISWB400 | C51: 66.7 | D51: 8501.0002 | E51: 400 | F51: 200 | G51: 13 | H51: 8.6 | I51: 234266992.19 | J51: 13880000 | K51: 166.0048 | L51: 40.4073 | M51: 16.6 | N51: 4.04 | O51: 340.5 | P51: 29.75 | Q51: 1171334.9609 | R51: 138800 | S51: ISWB400
B52: ISLB450 | C52: 65.3 | D52: 8313.9999 | E52: 450 | F52: 170 | G52: 13.4 | H52: 8.6 | I52: 275360996.09 | J52: 8530000 | K52: 181.9894 | L52: 32.0309 | M52: 18.2 | N52: 3.2 | O52: 384 | P52: 33 | Q52: 1223826.6493 | R52: 100352.9412 | S52: ISLB450
B53: ISMB450 | C53: 72.4 | D53: 9226.9997 | E53: 450 | F53: 150 | G53: 17.4 | H53: 9.4 | I53: 303908007.81 | J53: 8340000 | K53: 181.485 | L53: 30.0644 | M53: 18.15 | N53: 3.01 | O53: 379.2 | P53: 35.4 | Q53: 1350702.2569 | R53: 111200 | S53: ISMB450
B54: ISHB400-1 | C54: 77.4 | D54: 9866.0004 | E54: 400 | F54: 250 | G54: 12.7 | H54: 9.1 | I54: 280835000 | J54: 27283000.488 | K54: 168.7155 | L54: 52.5866 | M54: 16.87 | N54: 5.26 | O54: 340.1 | P54: 29.9 | Q54: 1404175 | R54: 218264.0039 | S54: ISHB400-1
B55: ISHB400-2 | C55: 82.2 | D55: 10466.0004 | E55: 400 | F55: 250 | G55: 12.7 | H55: 10.6 | I55: 288235000 | J55: 27830000 | K55: 165.9522 | L55: 51.5663 | M55: 16.61 | N55: 5.16 | O55: 340.1 | P55: 29.9 | Q55: 1441175 | R55: 222640 | S55: ISHB400-2
B56: ISLB500 | C56: 75 | D56: 9550 | E56: 500 | F56: 180 | G56: 14.1 | H56: 9.2 | I56: 385790000 | J56: 10639000.244 | K56: 200.9897 | L56: 33.3771 | M56: 20.1 | N56: 3.34 | O56: 430.2 | P56: 34.9 | Q56: 1543160 | R56: 118211.1138 | S56: ISLB500
B57: ISWB450 | C57: 79.4 | D57: 10115.0002 | E57: 450 | F57: 200 | G57: 15.4 | H57: 9.2 | I57: 350576015.6 | J57: 17066999.512 | K57: 186.1693 | L57: 41.0767 | M57: 18.63 | N57: 4.11 | O57: 384 | P57: 33 | Q57: 1558115.625 | R57: 170669.9951 | S57: ISWB450
B58: ISHB450-1 | C58: 87.2 | D58: 11113.9999 | E58: 450 | F58: 250 | G58: 13.7 | H58: 9.8 | I58: 392108007.8 | J58: 29651999.512 | K58: 187.8312 | L58: 51.6526 | M58: 18.78 | N58: 5.18 | O58: 386.2 | P58: 31.9 | Q58: 1742702.2569 | R58: 237215.9961 | S58: ISHB450-1
B59: ISHB450-2 | C59: 92.5 | D59: 11788.9999 | E59: 450 | F59: 250 | G59: 13.7 | H59: 11.3 | I59: 403498984.4 | J59: 30450000 | K59: 185.0047 | L59: 50.8224 | M59: 18.5 | N59: 5.08 | O59: 386.2 | P59: 31.9 | Q59: 1793328.8194 | R59: 243600 | S59: ISHB450-2
B60: ISMB500 | C60: 86.9 | D60: 11073.9998 | E60: 500 | F60: 180 | G60: 17.2 | H60: 10.2 | I60: 452183007.8 | J60: 13698000.488 | K60: 202.0714 | L60: 35.1703 | M60: 20.21 | N60: 3.52 | O60: 424.1 | P60: 37.95 | Q60: 1808732.0313 | R60: 152200.0054 | S60: ISMB500
B61: ISLB550 | C61: 96.3 | D61: 10997.0001 | E61: 550 | F61: 190 | G61: 15 | H61: 9.9 | I61: 531616015.6 | J61: 13350999.756 | K61: 219.8679 | L61: 34.8433 | M61: 21.99 | N61: 3.48 | O61: 476.1 | P61: 36.95 | Q61: 1933149.1477 | R61: 140536.8395 | S61: ISLB550
B62: ISWB500 | C62: 95.2 | D62: 12122.0001 | E62: 500 | F62: 250 | G62: 14.7 | H62: 9.9 | I62: 522908984.4 | J62: 29878000.488 | K62: 207.6949 | L62: 49.6465 | M62: 20.77 | N62: 4.96 | O62: 431 | P62: 34.5 | Q62: 2091635.9375 | R62: 239024.0039 | S62: ISWB500
B63: ISMB550 | C63: 103.7 | D63: 13211.0001 | E63: 550 | F63: 190 | G63: 19.3 | H63: 11.2 | I63: 648936015.6 | J63: 18338000.488 | K63: 221.6323 | L63: 37.257 | M63: 22.16 | N63: 3.73 | O63: 467.5 | P63: 41.25 | Q63: 2359767.3295 | R63: 193031.5841 | S63: ISMB550
B64: ISLB600 | C64: 99.5 | D64: 12669.0002 | E64: 600 | F64: 210 | G64: 15.5 | H64: 10.5 | I64: 728676015.6 | J64: 18219000.244 | K64: 239.8259 | L64: 37.922 | M64: 23.98 | N64: 3.79 | O64: 520.2 | P64: 39.9 | Q64: 2428920.0521 | R64: 173514.288 | S64: ISLB600
B65: ISWB550 | C65: 112.5 | D65: 14330.0003 | E65: 550 | F65: 250 | G65: 17.6 | H65: 10.5 | I65: 749061015.6 | J65: 37406000.98 | K65: 228.6312 | L65: 51.0914 | M65: 22.86 | N65: 5.11 | O65: 473.4 | P65: 38.3 | Q65: 2723858.2386 | R65: 299248.0078 | S65: ISWB550
B66: ISMB600 | C66: 122.6 | D66: 15621.0007 | E66: 600 | F66: 210 | G66: 20.8 | H66: 12 | I66: 918130000 | J66: 26510000 | K66: 242.4363 | L66: 41.1956 | M66: 24.24 | N66: 4.12 | O66: 509.7 | P66: 45.15 | Q66: 3060433.3333 | R66: 252476.1905 | S66: ISMB600
B67: ISWB600-1 | C67: 133.7 | D67: 17038.0005 | E67: 600 | F67: 250 | G67: 21.3 | H67: 11.2 | I67: 1061985000 | J67: 47025000 | K67: 249.6605 | L67: 52.5358 | M67: 24.97 | N67: 5.25 | O67: 514.2 | P67: 42.9 | Q67: 3539950 | R67: 376200 | S67: ISWB600-1
B68: ISWB600-2 | C68: 1451 | D68: 18486.0001 | E68: 600 | F68: 250 | G68: 23.6 | H68: 11.8 | I68: 1156266015.6 | J68: 52982998.05 | K68: 250.0964 | L68: 53.5361 | M68: 25.01 | N68: 5.35 | O68: 507.9 | P68: 46.05 | Q68: 3854220.052 | R68: 423863.9844 | S68: ISWB600-2

Sheet: Sheet4
A1: Remove it: H S Rai | D1: UNITS | J1: 1 | K1: 2 | L1: 3 | M1: 4 | N1: 5 | O1: 6 | P1: 7 | Q1: 8 | R1: 9 | S1: 10 | T1: 11 | U1: 12 | V1: 13 | W1: 14 | X1: 15 | Y1: 16 | Z1: 17 | AA1: 18 | AB1: 19 | AC1: 20
B2: Length | C2: 2000 | D2: mm | J2: Section Name | K2: Weight per Meter Kg | L2: Sectional Area mm2 | M2: Depth mm | N2: Width of flange mm | O2: Thickness of flange mm | P2: Thickness of web mm | Q2: Ixx | R2: Iyy | S2: rxx | T2: ryy | U2: Radius of root r1 | V2: Radius of toe r2 | W2: h1 | X2: h2 | Y2: Zxx | Z2: Zyy | AA2: Section Name | AC2: 19386.6659
B3: LL | C3: 8 | D3: KN/m | F3: E | G3: 200000 | AB3: 19386.6659 | AC3: 33600
B4: DL | C4: 0.6 | D4: KN/m | J4: ISLB75 | K4: 6.1 | L4: 771 | M4: 75 | N4: 50 | O4: 5 | P4: 3.7 | Q4: 726999.9695 | R4: 100000 | S4: 30.7072 | T4: 11.3887 | U4: 3.07 | V4: 1.14 | W4: 51.7 | X4: 11.65 | Y4: 19386.6659 | Z4: 4000 | AA4: ISLB75 | AB4: 33600 | AC4: 42946.6675
B5: TL | C5: of:=[.C3]+[.C4] -> 8.6 | D5: KN/m | J5: ISLB100 | K5: 8 | L5: 1021 | M5: 100 | N5: 50 | O5: 6.4 | P5: 4 | Q5: 1680000 | R5: 126999.9981 | S5: 40.5641 | T5: 11.1529 | U5: 4.06 | V5: 1.12 | W5: 73 | X5: 13.5 | Y5: 33600 | Z5: 5079.9999 | AA5: ISLB100 | AB5: 42946.6675 | AC5: 51500
B6: fy | C6: 250 | D6: N/mm | J6: ISJB150 | K6: 7.1 | L6: 901 | M6: 150 | N6: 50 | O6: 4.6 | P6: 3 | Q6: 3221000.061 | R6: 91999.9981 | S6: 59.7906 | T6: 10.1049 | U6: 5.98 | V6: 1.01 | W6: 130.4 | X6: 9.8 | Y6: 42946.6675 | Z6: 3679.9999 | AA6: ISJB150 | AB6: 51500 | AC6: 54777.1415
B7: SIGMAbc | C7: of:=0.66*[.C6] -> 165 | D7: N/mm | F7: min | G7: 19386.6659 | J7: ISMB100 | K7: 11.5 | L7: 1460 | M7: 100 | N7: 75 | O7: 7.2 | P7: 4 | Q7: 2575000 | R7: 407999.9924 | S7: 41.9964 | T7: 16.7168 | U7: 4.2 | V7: 1.67 | W7: 65 | X7: 17.5 | Y7: 51500 | Z7: 10879.9998 | AA7: ISMB100 | AB7: 54777.1415 | AC7: 65087.998
B8: Mmax | C8: of:=(([.C5]*[.C2]*[.C2])/8) -> 4300000 | D8: Nmm | J8: ISJB175 | K8: 8.1 | L8: 1028 | M8: 175 | N8: 50 | O8: 4.8 | P8: 3.2 | Q8: 4792999.878 | R8: 96999.9981 | S8: 68.2821 | T8: 9.7138 | U8: 6.83 | V8: 0.97 | W8: 155 | X8: 10 | Y8: 54777.1415 | Z8: 3879.9999 | AA8: ISJB175 | AB8: 65087.998 | AC8: 71840
B9: Vmax | C9: of:=(([.C5]*[.C2])/2) -> 8600 | D9: N | F9: max | G9: 3854220.052 | J9: ISLB125 | K9: 11.9 | L9: 1512 | M9: 125 | N9: 75 | O9: 6.5 | P9: 4.4 | Q9: 4067999.878 | R9: 434000.0153 | S9: 51.8698 | T9: 16.9422 | U9: 5.19 | V9: 1.69 | W9: 95.4 | X9: 14.8 | Y9: 65087.998 | Z9: 11573.3337 | AA9: ISLB125 | AB9: 71840 | AC9: 78070.0012
B10: Zreq | C10: of:=([.C8]/[.C7]) -> 26060.6060606061 | D10: mm3 | J10: ISMB125 | K10: 13 | L10: 1660 | M10: 125 | N10: 75 | O10: 7.6 | P10: 4.4 | Q10: 4490000 | R10: 437000.0076 | S10: 52.0079 | T10: 16.2251 | U10: 5.2 | V10: 1.62 | W10: 89.2 | X10: 17.9 | Y10: 71840 | Z10: 11653.3335 | AA10: ISMB125 | AB10: 78070.0012 | AC10: 91760.0016
J11: ISJB200 | K11: 9.9 | L11: 1264 | M11: 200 | N11: 60 | O11: 5 | P11: 3.4 | Q11: 7807000.122 | R11: 172999.9924 | S11: 78.5902 | T11: 11.699 | U11: 7.86 | V11: 1.17 | W11: 179.5 | X11: 10.25 | Y11: 78070.0012 | Z11: 5766.6664 | AA11: ISJB200 | AB11: 91760.0016 | AC11: 96853.3366
J12: ISLB150 | K12: 14.2 | L12: 1808 | M12: 150 | N12: 80 | O12: 6.8 | P12: 4.8 | Q12: 6882000.122 | R12: 552000.0076 | S12: 61.6962 | T12: 17.4731 | U12: 6.17 | V12: 1.75 | W12: 116.9 | X12: 16.55 | Y12: 91760.0016 | Z12: 13800.0002 | AA12: ISLB150 | AB12: 96853.3366 | AC12: 111879.9967
J13: ISMB150 | K13: 14.9 | L13: 1900 | M13: 150 | N13: 80 | O13: 7.6 | P13: 4.8 | Q13: 7264000.244 | R13: 525999.9847 | S13: 61.8317 | T13: 16.6386 | U13: 6.18 | V13: 1.66 | W13: 113.9 | X13: 18.05 | Y13: 96853.3366 | Z13: 13149.9996 | AA13: ISMB150 | AB13: 111879.9967 | AC13: 116311.1111
A14: ISLB | J14: ISWB150 | K14: 17 | L14: 2167 | M14: 150 | N14: 100 | O14: 7 | P14: 5.4 | Q14: 8390999.756 | R14: 948000.0305 | S14: 62.2268 | T14: 20.9158 | U14: 6.22 | V14: 2.09 | W14: 116.6 | X14: 16.7 | Y14: 111879.9967 | Z14: 18960.0006 | AA14: ISWB150 | AB14: 116311.1111 | AC14: 125279.9944
J15: ISJB225 | K15: 12.8 | L15: 1628.0001 | M15: 225 | N15: 80 | O15: 5 | P15: 3.7 | Q15: 13085000 | R15: 405000 | S15: 89.6519 | T15: 15.7725 | U15: 8.97 | V15: 1.58 | W15: 201.1 | X15: 11.95 | Y15: 116311.1111 | Z15: 10125 | AA15: ISJB225 | AB15: 125279.9944 | AC15: 145371.4286
A16: LOWER | B16: of:=VLOOKUP([.C10];[.Y4:.AA68];1) -> 19386.6659 | J16: ISLB175 | K16: 16.7 | L16: 2129.9999 | M16: 175 | N16: 90 | O16: 6.9 | P16: 5.1 | Q16: 10961999.512 | R16: 795999.9847 | S16: 71.739 | T16: 19.3316 | U16: 7.17 | V16: 1.93 | W16: 141.6 | X16: 16.7 | Y16: 125279.9944 | Z16: 17688.8885 | AA16: ISLB175 | AB16: 145371.4286 | AC16: 169659.9976
J17: ISMB175 | K17: 19.3 | L17: 2462.0001 | M17: 175 | N17: 90 | O17: 8.6 | P17: 5.5 | Q17: 12720000 | R17: 850000 | S17: 71.8786 | T17: 18.5808 | U17: 7.19 | V17: 1.86 | W17: 134.5 | X17: 20.25 | Y17: 145371.4286 | Z17: 18888.8889 | AA17: ISMB175 | AB17: 169659.9976 | AC17: 172502.8599
A18: UPPER 1 | B18: of:=VLOOKUP([.C10];[.Y4:.AB68];4) -> 33600 | D18: UPPER 2 | E18: of:=VLOOKUP([.C10];[.Y4:.AC68];5) -> 42946.6675 | J18: ISLB200 | K18: 19.8 | L18: 2527 | M18: 200 | N18: 100 | O18: 7.3 | P18: 5.4 | Q18: 16965999.756 | R18: 1154000.0153 | S18: 81.9383 | T18: 21.3698 | U18: 8.19 | V18: 2.13 | W18: 165.7 | X18: 17.15 | Y18: 169659.9976 | Z18: 23080.0003 | AA18: ISLB200 | AB18: 172502.8599 | AC18: 194079.9967
J19: ISWB175 | K19: 22.1 | L19: 2811.0001 | M19: 175 | N19: 125 | O19: 7.4 | P19: 5.8 | Q19: 15094000.244 | R19: 1886000.061 | S19: 73.2777 | T19: 25.9024 | U19: 7.33 | V19: 2.59 | W19: 139.5 | X19: 17.75 | Y19: 172502.8599 | Z19: 30176.001 | AA19: ISWB175 | AB19: 194079.9967 | AC19: 205333.3333
A20: SECTION SATISFIED | B20: of:=VLOOKUP([.B18];[.Y4:.AA68];3) -> ISLB100 | E20: of:=VLOOKUP([.E18];[.Y4:.AA68];3) -> ISJB150 | J20: ISHB150-1 | K20: 27.1 | L20: 3448 | M20: 150 | N20: 150 | O20: 9 | P20: 5.4 | Q20: 14555999.756 | R20: 4317000.122 | S20: 64.9737 | T20: 35.384 | U20: 6.5 | V20: 3.54 | W20: 112 | X20: 19 | Y20: 194079.9967 | Z20: 57560.0016 | AA20: ISHB150-1 | AB20: 205333.3333 | AC20: 218079.9967
J21: ISHB150-2 | K21: 30.6 | L21: 3898 | M21: 150 | N21: 150 | O21: 9 | P21: 8.4 | Q21: 15400000 | R21: 4802999.878 | S21: 62.8549 | T21: 35.1023 | U21: 6.29 | V21: 3.44 | W21: 112 | X21: 19 | Y21: 205333.3333 | Z21: 64039.9984 | AA21: ISHB150-2 | AB21: 218079.9967 | AC21: 222391.1024
A22: D | B22: of:=VLOOKUP([.B20];[.J4:.AA68];4) -> 100 | E22: of:=VLOOKUP([.E20];[.J4:.AA68];4) ->  | J22: ISHB150-3 | K22: 34.6 | L22: 4408.0002 | M22: 150 | N22: 150 | O22: 9 | P22: 11.8 | Q22: 16355999.756 | R22: 4948999.939 | S22: 60.9141 | T22: 33.5072 | U22: 6.09 | V22: 3.35 | W22: 112 | X22: 19 | Y22: 218079.9967 | Z22: 65986.6659 | AA22: ISHB150-3 | AB22: 222391.1024 | AC22: 223539.9902
A23: tf | B23: of:=VLOOKUP([.B20];[.J4:.AA68];6) -> 6.4 | E23: of:=VLOOKUP([.E20];[.J4:.AA68];6) ->  | J23: ISLB225 | K23: 23.5 | L23: 2992 | M23: 225 | N23: 100 | O23: 8.6 | P23: 5.8 | Q23: 25018999.023 | R23: 1126999.9695 | S23: 91.4438 | T23: 19.408 | U23: 9.15 | V23: 1.94 | W23: 180.3 | X23: 22.35 | Y23: 222391.1024 | Z23: 22539.9994 | AA23: ISLB225 | AB23: 223539.9902 | AC23: 262450
A24: tw | B24: of:=VLOOKUP([.B20];[.J4:.AA68];7) -> 4 | E24: of:=VLOOKUP([.E20];[.J4:.AA68];7) ->  | J24: ISMB200 | K24: 25.4 | L24: 3233.0002 | M24: 200 | N24: 100 | O24: 10.8 | P24: 5.7 | Q24: 22353999.023 | R24: 1500000 | S24: 83.1524 | T24: 21.5399 | U24: 8.32 | V24: 2.15 | W24: 152.7 | X24: 23.65 | Y24: 223539.9902 | Z24: 30000 | AA24: ISMB200 | AB24: 262450 | AC24: 297424.0039
A25: h2 | B25: of:=VLOOKUP([.B20];[.J4:.AA68];15) -> 13.5 | E25: of:=VLOOKUP([.E20];[.J4:.AA68];15) ->  | J25: ISWB200 | K25: 28.8 | L25: 3670.9999 | M25: 200 | N25: 140 | O25: 9 | P25: 6.1 | Q25: 26245000 | R25: 3287999.878 | S25: 84.5534 | T25: 29.9277 | U25: 8.46 | V25: 2.99 | W25: 158.8 | X25: 20.6 | Y25: 262450 | Z25: 46971.4268 | AA25: ISWB200 | AB25: 297424.0039 | AC25: 305937.7821
A26: zxx | B26: of:=VLOOKUP([.B20];[.J4:.AA68];16) -> 33600 | E26: of:=VLOOKUP([.E20];[.J8:.AA24];16) ->  | J26: ISLB250 | K26: 27.9 | L26: 3552.9999 | M26: 250 | N26: 125 | O26: 8.2 | P26: 6.1 | Q26: 37178000.49 | R26: 1933999.939 | S26: 102.2929 | T26: 23.3309 | U26: 10.23 | V26: 2.33 | W26: 202.6 | X26: 23.7 | Y26: 297424.0039 | Z26: 30943.999 | AA26: ISLB250 | AB26: 305937.7821 | AC26: 348488.8889
A27: ixx | B27: of:=VLOOKUP([.B20];[.J4:.AA68];8) -> 1680000 | E27: of:=VLOOKUP([.E20];[.J4:.AA68];8) ->  | J27: ISMB225 | K27: 31.2 | L27: 3972.0001 | M27: 225 | N27: 110 | O27: 11.8 | P27: 6.5 | Q27: 34418000.49 | R27: 2183000.0305 | S27: 93.0868 | T27: 23.4435 | U27: 9.31 | V27: 2.34 | W27: 173.3 | X27: 25.85 | Y27: 305937.7821 | Z27: 39690.9096 | AA27: ISMB225 | AB27: 348488.8889 | AC27: 360839.9902
A28: iyy | B28: of:=VLOOKUP([.B20];[.J4:.AA68];9) -> 126999.9981 | E28: of:=VLOOKUP([.E20];[.J4:.AA68];9) ->  | J28: ISWB225 | K28: 33.9 | L28: 4324.0002 | M28: 225 | N28: 150 | O28: 9.9 | P28: 6.4 | Q28: 39205000 | R28: 4486000.061 | S28: 95.2199 | T28: 32.2097 | U28: 9.52 | V28: 3.22 | W28: 181.4 | X28: 21.8 | Y28: 348488.8889 | Z28: 59813.3341 | AA28: ISWB225 | AB28: 360839.9902 | AC28: 372180.0049
A29: ryy | B29: of:=VLOOKUP([.B20];[.J4:.AA68];11) -> 11.1529 | E29: of:=VLOOKUP([.E20];[.J4:.AA68];11) ->  | J29: ISHB200-1 | K29: 37.3 | L29: 4754.0001 | M29: 200 | N29: 200 | O29: 9 | P29: 6.1 | Q29: 36083999.02 | R29: 9670999.756 | S29: 87.122 | T29: 45.1031 | U29: 8.71 | V29: 4.51 | W29: 158.4 | X29: 20.8 | Y29: 360839.9902 | Z29: 96709.9976 | AA29: ISHB200-1 | AB29: 372180.0049 | AC29: 390930.8949
J30: ISHB200-2 | K30: 40 | L30: 5093.9999 | M30: 200 | N30: 200 | O30: 9 | P30: 7.8 | Q30: 37218000.49 | R30: 9945999.756 | S30: 85.4766 | T30: 44.187 | U30: 8.55 | V30: 4.42 | W30: 158.4 | X30: 20.8 | Y30: 372180.0049 | Z30: 99459.9976 | AA30: ISHB200-2 | AB30: 390930.8949 | AC30: 410528.0078
A31: Check fo shear | J31: ISLB275 | K31: 33 | L31: 4202 | M31: 275 | N31: 140 | O31: 8.8 | P31: 6.4 | Q31: 53752998.05 | R31: 2870000 | S31: 113.1028 | T31: 26.1344 | U31: 11.31 | V31: 2.61 | W31: 223.7 | X31: 25.65 | Y31: 390930.8949 | Z31: 41000 | AA31: ISLB275 | AB31: 410528.0078 | AC31: 469288.8889
J32: ISMB250 | K32: 37.3 | L32: 4754.9999 | M32: 250 | N32: 125 | O32: 12.5 | P32: 6.9 | Q32: 51316000.98 | R32: 3345000 | S32: 103.8846 | T32: 26.523 | U32: 10.39 | V32: 2.65 | W32: 194.1 | X32: 27.95 | Y32: 410528.0078 | Z32: 53520 | AA32: ISMB250 | AB32: 469288.8889 | AC32: 475448.0078
A33: tau(va) | B33: of:=[.C9]/([.B22]*[.B24]) -> 21.5 | C33: of:=IF([.B33]<100;"safe";"un safe" ) -> safe | E33: of:=[.C9]/([.E22]*[.E24]) ->  | F33: <100 safe | J33: ISHB225-1 | K33: 43.1 | L33: 5493.9999 | M33: 225 | N33: 225 | O33: 9.1 | P33: 6.5 | Q33: 52795000 | R33: 13538000.488 | S33: 98.0284 | T33: 49.6401 | U33: 9.8 | V33: 4.96 | W33: 180.5 | X33: 22.2 | Y33: 469288.8889 | Z33: 120337.7821 | AA33: ISHB225-1 | AB33: 475448.0078 | AC33: 487004.4271
J34: ISWB250 | K34: 40.9 | L34: 5204.9999 | M34: 250 | N34: 200 | O34: 9 | P34: 6.7 | Q34: 59431000.98 | R34: 8575000 | S34: 106.8553 | T34: 40.5888 | U34: 10.69 | V34: 4.06 | W34: 203.8 | X34: 231 | Y34: 475448.0078 | Z34: 85750 | AA34: ISWB250 | AB34: 487004.4271 | AC34: 488859.9935
A35: check for deflection | J35: ISHB225-2 | K35: 46.8 | L35: 5966 | M35: 225 | N35: 225 | O35: 9.1 | P35: 8.6 | Q35: 54787998.05 | R35: 13965999.756 | S35: 95.8299 | T35: 48.3832 | U35: 9.58 | V35: 4.84 | W35: 180.5 | X35: 22.2 | Y35: 487004.4271 | Z35: 124142.2201 | AA35: ISHB225-2 | AB35: 488859.9935 | AC35: 573573.3073
J36: ISLB300 | K36: 37.7 | L36: 4808.0002 | M36: 300 | N36: 150 | O36: 9.4 | P36: 6.7 | Q36: 73328999.02 | R36: 3762000.122 | S36: 123.4968 | T36: 27.9722 | U36: 12.35 | V36: 2.8 | W36: 245.1 | X36: 27.45 | Y36: 488859.9935 | Z36: 50160.0016 | AA36: ISLB300 | AB36: 573573.3073 | AC36: 607667.6683
A37: Delta allowable | B37: of:=([.C2])/325 -> 6.15384615384615 | J37: ISMB300 | K37: 44.2 | L37: 5625.9998 | M37: 300 | N37: 140 | O37: 12.4 | P37: 7.5 | Q37: 86035996.09 | R37: 4538999.939 | S37: 123.6631 | T37: 28.404 | U37: 12.37 | V37: 2.84 | W37: 241.5 | X37: 29.25 | Y37: 573573.3073 | Z37: 64842.8563 | AA37: ISMB300 | AB37: 607667.6683 | AC37: 618920
J38: ISLB325 | K38: 43.1 | L38: 5490.0002 | M38: 325 | N38: 165 | O38: 9.8 | P38: 7 | Q38: 98745996.09 | R38: 5107999.878 | S38: 134.1138 | T38: 30.5028 | U38: 13.41 | V38: 3.05 | W38: 266.5 | X38: 29.25 | Y38: 607667.6683 | Z38: 61915.15 | AA38: ISLB325 | AB38: 618920 | AC38: 638711.9922
A39: Delta calculated | B39: of:=(5*[.C5]*([.C2]*[.C2]*[.C2]*[.C2]))/(384*[.G3]*[.B27]) -> 5.33234126984127 | C39: of:=IF([.B39]<[.B37];"safe";"un safe" ) -> safe | E39: of:=(5*[.C5]*([.C2]*[.C2]*[.C2]*[.C2]))/(384*[.G3]*[.E27]) ->  | F39: of:=IF([.E39]<[.B37];"safe";"un safe" ) ->  | J39: ISHB250-1 | K39: 51 | L39: 6495.9999 | M39: 250 | N39: 250 | O39: 9.7 | P39: 6.9 | Q39: 77365000 | R39: 19613000.488 | S39: 109.1313 | T39: 54.9476 | U39: 10.91 | V39: 5.49 | W39: 203.5 | X39: 23.2 | Y39: 618920 | Z39: 156904.0039 | AA39: ISHB250-1 | AB39: 638711.9922 | AC39: 654773.3073
J40: ISHB250-2 | K40: 54.7 | L40: 6970.9999 | M40: 250 | N40: 250 | O40: 9.7 | P40: 8.8 | Q40: 79838999.02 | R40: 20116999.512 | S40: 107.0188 | T40: 53.7198 | U40: 10.7 | V40: 5.37 | W40: 203.5 | X40: 23.2 | Y40: 638711.9922 | Z40: 160935.9961 | AA40: ISHB250-2 | AB40: 654773.3073 | AC40: 751902.846
J41: ISWB300 | K41: 48.1 | L41: 6133.0002 | M41: 300 | N41: 200 | O41: 10 | P41: 7.4 | Q41: 98215996.09 | R41: 9900999.756 | S41: 126.5478 | T41: 40.1794 | U41: 12.66 | V41: 4.02 | W41: 250.1 | X41: 24.95 | Y41: 654773.3073 | Z41: 99009.9976 | AA41: ISWB300 | AB41: 751902.846 | AC41: 778874.2746
A42: CHECK FOR CRIPLING | J42: ISLB350 | K42: 49.5 | L42: 6300.9998 | M42: 350 | N42: 165 | O42: 11.4 | P42: 7.4 | Q42: 131582998.05 | R42: 6319000.244 | S42: 144.5091 | T42: 31.6679 | U42: 14.45 | V42: 3.17 | W42: 288.3 | X42: 30.85 | Y42: 751902.846 | Z42: 76593.9424 | AA42: ISLB350 | AB42: 778874.2746 | AC42: 836346.6797
J43: ISMB350 | K43: 52.4 | L43: 6670.9999 | M43: 350 | N43: 140 | O43: 14.2 | P43: 8.1 | Q43: 136302998.05 | R43: 5377000.122 | S43: 142.9411 | T43: 28.3906 | U43: 14.29 | V43: 2.84 | W43: 288 | X43: 31 | Y43: 778874.2746 | Z43: 76814.2875 | AA43: ISMB350 | AB43: 836346.6797 | AC43: 863346.6797
A44: ASSUME BEARING LENGTH (b) | C44: 100 | D44: mm | J44: ISHB300-1 | K44: 58.8 | L44: 7484.9998 | M44: 300 | N44: 250 | O44: 10.6 | P44: 7.6 | Q44: 125452001.95 | R44: 21936000.977 | S44: 129.4622 | T44: 54.1356 | U44: 12.95 | V44: 5.41 | W44: 249.8 | X44: 25.1 | Y44: 836346.6797 | Z44: 175488.0078 | AA44: ISHB300-1 | AB44: 863346.6797 | AC44: 886954.2969
J45: ISHB300-2 | K45: 63 | L45: 8025 | M45: 300 | N45: 250 | O45: 10.6 | P45: 9.4 | Q45: 129502001.95 | R45: 22466999.512 | S45: 127.0328 | T45: 52.9115 | U45: 12.7 | V45: 5.29 | W45: 249.8 | X45: 25.1 | Y45: 863346.6797 | Z45: 179735.9961 | AA45: ISHB300-2 | AB45: 886954.2969 | AC45: 965315.0391
A46: SIGMA P | B46: of:=[.C9]/(([.C44]+([.B25]*1.73))*[.B24]) -> 17.4293705159904 | C46: of:=IF([.B46]<(0.75*[.C6]);"SAFE";"UN SAFE") -> SAFE | E46: of:=[.C9]/(([.C44]+([.E25]*1.73))*[.E24]) ->  | F46: of:=IF([.E46]<(0.75*[.C6]);"SAFE";"UN SAFE") ->  | J46: ISWB350 | K46: 56.9 | L46: 7250 | M46: 350 | N46: 200 | O46: 11.4 | P46: 8 | Q46: 155217001.95 | R46: 11759000.244 | S46: 146.319 | T46: 40.2732 | U46: 14.63 | V46: 4.03 | W46: 295.5 | X46: 27.25 | Y46: 886954.2969 | Z46: 117590.0024 | AA46: ISWB350 | AB46: 965315.0391 | AC46: 1022920.0195
J47: ISLB400 | K47: 56.9 | L47: 7243 | M47: 400 | N47: 165 | O47: 12.5 | P47: 8 | Q47: 193063007.81 | R47: 7164000.244 | S47: 163.2639 | T47: 31.4498 | U47: 16.33 | V47: 3.15 | W47: 336.2 | X47: 31.9 | Y47: 965315.0391 | Z47: 86836.3666 | AA47: ISLB400 | AB47: 1022920.0195 | AC47: 1094839.9554
J48: ISMB400 | K48: 61.6 | L48: 7845.9999 | M48: 400 | N48: 140 | O48: 16 | P48: 8.9 | Q48: 204584003.91 | R48: 6220999.756 | S48: 161.4774 | T48: 28.1583 | U48: 16.15 | V48: 2.82 | W48: 334.4 | X48: 32.8 | Y48: 1022920.0195 | Z48: 88871.4251 | AA48: ISMB400 | AB48: 1094839.9554 | AC48: 1131588.6161
J49: ISHB350-1 | K49: 67.4 | L49: 8591.0004 | M49: 350 | N49: 250 | O49: 11.6 | P49: 8.3 | Q49: 191596992.19 | R49: 24513999.023 | S49: 149.3387 | T49: 53.4177 | U49: 14.93 | V49: 5.34 | W49: 296 | X49: 27 | Y49: 1094839.9554 | Z49: 196111.9922 | AA49: ISHB350-1 | AB49: 1131588.6161 | AC49: 1171334.9609
J50: ISHB350-2 | K50: 72.4 | L50: 9220.9999 | M50: 350 | N50: 250 | O50: 11.6 | P50: 10.1 | Q50: 198028007.81 | R50: 25105000 | S50: 146.5461 | T50: 52.1784 | U50: 14.65 | V50: 5.22 | W50: 296 | X50: 27 | Y50: 1131588.6161 | Z50: 200840 | AA50: ISHB350-2 | AB50: 1171334.9609 | AC50: 1223826.6493
J51: ISWB400 | K51: 66.7 | L51: 8501.0002 | M51: 400 | N51: 200 | O51: 13 | P51: 8.6 | Q51: 234266992.19 | R51: 13880000 | S51: 166.0048 | T51: 40.4073 | U51: 16.6 | V51: 4.04 | W51: 340.5 | X51: 29.75 | Y51: 1171334.9609 | Z51: 138800 | AA51: ISWB400 | AB51: 1223826.6493 | AC51: 1350702.2569
J52: ISLB450 | K52: 65.3 | L52: 8313.9999 | M52: 450 | N52: 170 | O52: 13.4 | P52: 8.6 | Q52: 275360996.09 | R52: 8530000 | S52: 181.9894 | T52: 32.0309 | U52: 18.2 | V52: 3.2 | W52: 384 | X52: 33 | Y52: 1223826.6493 | Z52: 100352.9412 | AA52: ISLB450 | AB52: 1350702.2569 | AC52: 1404175
J53: ISMB450 | K53: 72.4 | L53: 9226.9997 | M53: 450 | N53: 150 | O53: 17.4 | P53: 9.4 | Q53: 303908007.81 | R53: 8340000 | S53: 181.485 | T53: 30.0644 | U53: 18.15 | V53: 3.01 | W53: 379.2 | X53: 35.4 | Y53: 1350702.2569 | Z53: 111200 | AA53: ISMB450 | AB53: 1404175 | AC53: 1441175
J54: ISHB400-1 | K54: 77.4 | L54: 9866.0004 | M54: 400 | N54: 250 | O54: 12.7 | P54: 9.1 | Q54: 280835000 | R54: 27283000.488 | S54: 168.7155 | T54: 52.5866 | U54: 16.87 | V54: 5.26 | W54: 340.1 | X54: 29.9 | Y54: 1404175 | Z54: 218264.0039 | AA54: ISHB400-1 | AB54: 1441175 | AC54: 1543160
D55: FINAL SECTION | E55: of:=IF([.C39]="un safe";[.E20];[.B20]) -> ISLB100 | J55: ISHB400-2 | K55: 82.2 | L55: 10466.0004 | M55: 400 | N55: 250 | O55: 12.7 | P55: 10.6 | Q55: 288235000 | R55: 27830000 | S55: 165.9522 | T55: 51.5663 | U55: 16.61 | V55: 5.16 | W55: 340.1 | X55: 29.9 | Y55: 1441175 | Z55: 222640 | AA55: ISHB400-2 | AB55: 1543160 | AC55: 1558115.625
J56: ISLB500 | K56: 75 | L56: 9550 | M56: 500 | N56: 180 | O56: 14.1 | P56: 9.2 | Q56: 385790000 | R56: 10639000.244 | S56: 200.9897 | T56: 33.3771 | U56: 20.1 | V56: 3.34 | W56: 430.2 | X56: 34.9 | Y56: 1543160 | Z56: 118211.1138 | AA56: ISLB500 | AB56: 1558115.625 | AC56: 1742702.2569
J57: ISWB450 | K57: 79.4 | L57: 10115.0002 | M57: 450 | N57: 200 | O57: 15.4 | P57: 9.2 | Q57: 350576015.6 | R57: 17066999.512 | S57: 186.1693 | T57: 41.0767 | U57: 18.63 | V57: 4.11 | W57: 384 | X57: 33 | Y57: 1558115.625 | Z57: 170669.9951 | AA57: ISWB450 | AB57: 1742702.2569 | AC57: 1793328.8194
J58: ISHB450-1 | K58: 87.2 | L58: 11113.9999 | M58: 450 | N58: 250 | O58: 13.7 | P58: 9.8 | Q58: 392108007.8 | R58: 29651999.512 | S58: 187.8312 | T58: 51.6526 | U58: 18.78 | V58: 5.18 | W58: 386.2 | X58: 31.9 | Y58: 1742702.2569 | Z58: 237215.9961 | AA58: ISHB450-1 | AB58: 1793328.8194 | AC58: 1808732.0313
J59: ISHB450-2 | K59: 92.5 | L59: 11788.9999 | M59: 450 | N59: 250 | O59: 13.7 | P59: 11.3 | Q59: 403498984.4 | R59: 30450000 | S59: 185.0047 | T59: 50.8224 | U59: 18.5 | V59: 5.08 | W59: 386.2 | X59: 31.9 | Y59: 1793328.8194 | Z59: 243600 | AA59: ISHB450-2 | AB59: 1808732.0313 | AC59: 1933149.1477
J60: ISMB500 | K60: 86.9 | L60: 11073.9998 | M60: 500 | N60: 180 | O60: 17.2 | P60: 10.2 | Q60: 452183007.8 | R60: 13698000.488 | S60: 202.0714 | T60: 35.1703 | U60: 20.21 | V60: 3.52 | W60: 424.1 | X60: 37.95 | Y60: 1808732.0313 | Z60: 152200.0054 | AA60: ISMB500 | AB60: 1933149.1477 | AC60: 2091635.9375
J61: ISLB550 | K61: 96.3 | L61: 10997.0001 | M61: 550 | N61: 190 | O61: 15 | P61: 9.9 | Q61: 531616015.6 | R61: 13350999.756 | S61: 219.8679 | T61: 34.8433 | U61: 21.99 | V61: 3.48 | W61: 476.1 | X61: 36.95 | Y61: 1933149.1477 | Z61: 140536.8395 | AA61: ISLB550 | AB61: 2091635.9375 | AC61: 2359767.3295
J62: ISWB500 | K62: 95.2 | L62: 12122.0001 | M62: 500 | N62: 250 | O62: 14.7 | P62: 9.9 | Q62: 522908984.4 | R62: 29878000.488 | S62: 207.6949 | T62: 49.6465 | U62: 20.77 | V62: 4.96 | W62: 431 | X62: 34.5 | Y62: 2091635.9375 | Z62: 239024.0039 | AA62: ISWB500 | AB62: 2359767.3295 | AC62: 2428920.0521
J63: ISMB550 | K63: 103.7 | L63: 13211.0001 | M63: 550 | N63: 190 | O63: 19.3 | P63: 11.2 | Q63: 648936015.6 | R63: 18338000.488 | S63: 221.6323 | T63: 37.257 | U63: 22.16 | V63: 3.73 | W63: 467.5 | X63: 41.25 | Y63: 2359767.3295 | Z63: 193031.5841 | AA63: ISMB550 | AB63: 2428920.0521 | AC63: 2723858.2386
J64: ISLB600 | K64: 99.5 | L64: 12669.0002 | M64: 600 | N64: 210 | O64: 15.5 | P64: 10.5 | Q64: 728676015.6 | R64: 18219000.244 | S64: 239.8259 | T64: 37.922 | U64: 23.98 | V64: 3.79 | W64: 520.2 | X64: 39.9 | Y64: 2428920.0521 | Z64: 173514.288 | AA64: ISLB600 | AB64: 2723858.2386 | AC64: 3060433.3333
J65: ISWB550 | K65: 112.5 | L65: 14330.0003 | M65: 550 | N65: 250 | O65: 17.6 | P65: 10.5 | Q65: 749061015.6 | R65: 37406000.98 | S65: 228.6312 | T65: 51.0914 | U65: 22.86 | V65: 5.11 | W65: 473.4 | X65: 38.3 | Y65: 2723858.2386 | Z65: 299248.0078 | AA65: ISWB550 | AB65: 3060433.3333 | AC65: 3539950
J66: ISMB600 | K66: 122.6 | L66: 15621.0007 | M66: 600 | N66: 210 | O66: 20.8 | P66: 12 | Q66: 918130000 | R66: 26510000 | S66: 242.4363 | T66: 41.1956 | U66: 24.24 | V66: 4.12 | W66: 509.7 | X66: 45.15 | Y66: 3060433.3333 | Z66: 252476.1905 | AA66: ISMB600 | AB66: 3539950 | AC66: 3854220.052
J67: ISWB600-1 | K67: 133.7 | L67: 17038.0005 | M67: 600 | N67: 250 | O67: 21.3 | P67: 11.2 | Q67: 1061985000 | R67: 47025000 | S67: 249.6605 | T67: 52.5358 | U67: 24.97 | V67: 5.25 | W67: 514.2 | X67: 42.9 | Y67: 3539950 | Z67: 376200 | AA67: ISWB600-1 | AB67: 3854220.052
J68: ISWB600-2 | K68: 1451 | L68: 18486.0001 | M68: 600 | N68: 250 | O68: 23.6 | P68: 11.8 | Q68: 1156266015.6 | R68: 52982998.05 | S68: 250.0964 | T68: 53.5361 | U68: 25.01 | V68: 5.35 | W68: 507.9 | X68: 46.05 | Y68: 3854220.052 | Z68: 423863.9844 | AA68: ISWB600-2
J70: Section Name | K70: Weight per Meter Kg | L70: Sectional Area mm2 | M70: Depth mm | N70: Width of flange mm | O70: Thickness of flange mm | P70: Thickness of web mm | Q70: Ixx | R70: Iyy | S70: rxx | T70: ryy | U70: Radius of root r1 | V70: Radius of toe r2 | W70: h1 | X70: h2 | Y70: Zxx | Z70: Zyy | AA70: Section Name